Walk,Grade,Length,Time,GPS START,Link,Hours,Biome,Region
Broadford Marble Line,1,13km,3 hours,"57.24170,-5.91050",https://www.walkhighlands.co.uk/skye/marble-line.shtml,3,Heritage,Isle of Skye
"Prince Charlie's Cave, Elgol",2,4km,2 - 3 hours,"57.14550,-6.10780",https://www.walkhighlands.co.uk/skye/prince-charlies-cave.shtml,3,Coastal,Isle of Skye
"Rubha Ardnish, Broadford",2,6.5km,2 hours,"57.23800,-5.88470",https://www.walkhighlands.co.uk/skye/rubhaardnish.shtml,2,Coastal,Isle of Skye
"Keppoch Clearance Village, near Torrin",2,6.5km,3 hours,"57.22030,-6.04290",https://www.walkhighlands.co.uk/skye/keppoch.shtml,3,Coastal,Isle of Skye
Loch Coruisk circuit (access by boat),2,7km,3 - 4 hours,"57.19770,-6.16300",https://www.walkhighlands.co.uk/skye/lochcoruisk.shtml,4,Coastal,Isle of Skye
Boreraig and Suisnish: the Cleared Coast,2,16.5km,5 - 6 hours,"57.21470,-5.94800",https://www.walkhighlands.co.uk/skye/boreraigsuisnish.shtml,6,Heritage,Isle of Skye
"Beinn na Cro, Torrin",3,4km,2.5 - 3.5 hours,"57.22750,-6.03580",https://www.walkhighlands.co.uk/skye/beinnnacro.shtml,3.5,Mountain,Isle of Skye
Elgol peninsula circuit,3,18km,6 - 8 hours,"57.17980,-6.06370",https://www.walkhighlands.co.uk/skye/elgolpeninsula.shtml,8,Coastal,Isle of Skye
"The Spar Cave, near Elgol",4,1.3km,2 hours,"57.14230,-6.07290",https://www.walkhighlands.co.uk/skye/sparcave.shtml,2,Coastal,Isle of Skye
Blŕ Bheinn (Blaven),4,8km,5 - 6 hours,"57.22030,-6.04290",https://www.walkhighlands.co.uk/skye/blabheinn.shtml,6,Mountain,Isle of Skye
Beinn na Caillich and the Broadford Red Hills,4,8.5km,4 - 6 hours,"57.23360,-5.94670",https://www.walkhighlands.co.uk/skye/beinnnacailleach.shtml,6,Mountain,Isle of Skye
Garbh Bheinn and Belig,4,10km,5 - 7 hours,"57.26440,-6.09150",https://www.walkhighlands.co.uk/skye/garbhbheinn.shtml,7,Mountain,Isle of Skye
Marsco from Sligachan,4,14km,5 - 6 hours,"57.29050,-6.17170",https://www.walkhighlands.co.uk/skye/marsco.shtml,6,Mountain,Isle of Skye
"Důn Scaith Castle, Tokavaig",1,2km,40 minutes,"57.13420,-5.96880",https://www.walkhighlands.co.uk/skye/dunscaith.shtml,0.66,Heritage,Isle of Skye
Kylerhea Otter Hide trail,1,2.25km,1 hour,"57.22730,-5.66860",https://www.walkhighlands.co.uk/skye/kylerheaotter.shtml,1,Coastal,Isle of Skye
"Cnoc a'Mhadaidh Ruaidh, Kyleakin",1,3km,1 hour,"57.27170,-5.74460",https://www.walkhighlands.co.uk/skye/cnoc-a-mhadaidh-ruaidh.shtml,1,Forest,Isle of Skye
Caisteal Maol and Kyleakin,1,3.5km,1 - 1.5 hours,"57.27290,-5.72950",https://www.walkhighlands.co.uk/skye/caistealmaol.shtml,1.5,Heritage,Isle of Skye
Kinloch Forest and Leitir Fura,1,6.5km,2 - 3 hours,"57.17770,-5.79890",https://www.walkhighlands.co.uk/skye/kinlochforest.shtml,3,Forest,Isle of Skye
Armadale hill and woodland,2,6km,2 hours,"57.06490,-5.90040",https://www.walkhighlands.co.uk/skye/armadale.shtml,2,Heritage,Isle of Skye
Point of Sleat,2,8.5km,3 - 4 hours,"57.03470,-5.97540",https://www.walkhighlands.co.uk/skye/pointofsleat.shtml,4,Coastal,Isle of Skye
Coille Dalavil,2,12.5km,4 - 5 hours,"57.09070,-5.92600",https://www.walkhighlands.co.uk/skye/coille-dalavil.shtml,5,Forest,Isle of Skye
Kylerhea hills circuit,4,14km,8 - 10 hours,"57.22780,-5.66870",https://www.walkhighlands.co.uk/skye/kylerheahills.shtml,10,Mountain,Isle of Skye
Bagh an Inbhire (Inver Bay),2,3km,1.5 hours,"57.39980,-6.06080",https://www.walkhighlands.co.uk/skye/bagh-an-inbhire.shtml,1.5,Coastal,Isle of Skye
"Calum's Path and Fladda, from Arnish",2,5.5km,2 - 2.5 hours,"57.45830,-6.01320",https://www.walkhighlands.co.uk/skye/torran.shtml,2.5,Coastal,Isle of Skye
Screapadal,2,5.5km,1.5 - 2 hours,"57.44070,-6.03630",https://www.walkhighlands.co.uk/skye/screapadal.shtml,2,Heritage,Isle of Skye
"Churchton Bay, Inverarish & Raasay woodlands",2,6.5km,2 - 2.5 hours,"57.35050,-6.08180",https://www.walkhighlands.co.uk/skye/raasay.shtml,2.5,Heritage,Isle of Skye
"Hallaig, from North Fearns, Raasay",2,6.5km,2 hours,"57.35050,-6.00400",https://www.walkhighlands.co.uk/skye/hallaig.shtml,2,Heritage,Isle of Skye
The Ironstone Mines and the Burma Road,2,10km,3 - 4 hours,"57.35050,-6.08180",https://www.walkhighlands.co.uk/skye/ironstone-mine.shtml,4,Heritage,Isle of Skye
Důn Caan,3,15.5km,4.5 - 6 hours,"57.35050,-6.08180",https://www.walkhighlands.co.uk/skye/duncaan.shtml,6,Mountain,Isle of Skye
"River Lundie walk, Leanachan Forest",1,3.5km,1 hour,"56.85110,-5.00250",https://www.walkhighlands.co.uk/fortwilliam/leanachan-forest.shtml,1,Forest,Fort William and Lochaber
"The Lower Falls and Achriabhach Forest, Glen Nevis",1,3.5km,1.5 - 2 hours,"56.76950,-5.03720",https://www.walkhighlands.co.uk/fortwilliam/achriabhach.shtml,2,Forest,Fort William and Lochaber
Nevis Range Gondola viewpoint walks,1,4km,1 - 2 hours,"56.83640,-4.97290",https://www.walkhighlands.co.uk/fortwilliam/nevis-range.shtml,2,Mountain,Fort William and Lochaber
"Neptune's Staircase and the Canal, Banavie",1,4.5km,1 - 1.5 hours,"56.84530,-5.09681",https://www.walkhighlands.co.uk/fortwilliam/neptunesstaircase.shtml,1.5,Heritage,Fort William and Lochaber
"The Old Fort and Inverlochy Castle, Fort William",1,4.5km,1 - 1.5 hours,"56.82150,-5.10780",https://www.walkhighlands.co.uk/fortwilliam/inverlochy-castle.shtml,1.5,Heritage,Fort William and Lochaber
River Nevis short walk,1,4.5km,1 - 1.5 hours,"56.81080,-5.07710",https://www.walkhighlands.co.uk/fortwilliam/rivernevis.shtml,1.5,River,Fort William and Lochaber
Steall Falls and the Nevis Gorge,2,3.5km,1.5 - 2 hours,"56.77760,-5.00030",https://www.walkhighlands.co.uk/fortwilliam/steallfalls.shtml,2,River,Fort William and Lochaber
"Důn Deardail fort, Glen Nevis",2,10km,2.5 - 3.5 hours,"56.81600,-5.07920",https://www.walkhighlands.co.uk/fortwilliam/dun-deardail.shtml,3.5,Heritage,Fort William and Lochaber
The North Face of Ben Nevis & Allt a' Mhuilinn,2,10.25km,3.5 - 4 hours,"56.84190,-5.04320",https://www.walkhighlands.co.uk/fortwilliam/north-face.shtml,4,Mountain,Fort William and Lochaber
"Cow Hill circuit, Fort William",2,11km,3 - 4 hours,"56.81980,-5.10790",https://www.walkhighlands.co.uk/fortwilliam/cowhill.shtml,4,Mountain,Fort William and Lochaber
Glen Nevis and Polldubh Falls,2,13km,3 - 5 hours,"56.81080,-5.07710",https://www.walkhighlands.co.uk/fortwilliam/glennevis.shtml,5,River,Fort William and Lochaber
Ben Nevis by the Mountain Path,3,17km,7 - 9 hours,"56.81080,-5.07710",https://www.walkhighlands.co.uk/fortwilliam/bennevis.shtml,9,Mountain,Fort William and Lochaber
Aonach Mňr and Beag via the Gondola,4,9.5km,4.5 - 5.5 hours,"56.83640,-4.97290",https://www.walkhighlands.co.uk/fortwilliam/aonachs-gondola.shtml,5.5,Mountain,Fort William and Lochaber
Stob Ban (Mamores) and Mullach nan Coirean,4,13km,6 - 8 hours,"56.76950,-5.03720",https://www.walkhighlands.co.uk/fortwilliam/stobban.shtml,8,Mountain,Fort William and Lochaber
Aonach Beag and Aonach Mňr from Glen Nevis,4,16.5km,8 - 10 hours,"56.77770,-5.00031",https://www.walkhighlands.co.uk/fortwilliam/aonachmor.shtml,10,Mountain,Fort William and Lochaber
"The Ring of Steall, Mamores",5,16km,9 - 12 hours,"56.77770,-5.00034",https://www.walkhighlands.co.uk/fortwilliam/ringofsteall.shtml,12,Mountain,Fort William and Lochaber
Ben Nevis by the Cŕrn Mňr Dearg Aręte,5,17.5km,10 - 11 hours,"56.84190,-5.04320",https://www.walkhighlands.co.uk/fortwilliam/carnmordeargarete.shtml,11,Mountain,Fort William and Lochaber
"Allt Dubh and Alderwood trails, Creag Meagaidh NNR",1,2.5km,1 hour,"56.95200,-4.49590",https://www.walkhighlands.co.uk/fortwilliam/aberarder.shtml,1,Forest,Fort William and Lochaber
"Commando Memorial & High Bridge, Spean Bridge",1,4.5km,1.5 hours,"56.89850,-4.94480",https://www.walkhighlands.co.uk/fortwilliam/commando-memorial.shtml,1.5,Heritage,Fort William and Lochaber
"Killiechonate Forest, Spean Bridge",1,4.5km,1 - 1.5 hours,"56.89080,-4.91160",https://www.walkhighlands.co.uk/fortwilliam/killiechonate-forest.shtml,1.5,Forest,Fort William and Lochaber
Loch Ossian circuit from Corrour Station,1,14.5km,4.5 - 5.5 hours,"56.76040,-4.69070",https://www.walkhighlands.co.uk/fortwilliam/loch-ossian.shtml,5.5,Wetland,Fort William and Lochaber
Parallel Roads of Glen Roy,2,4km,1 - 1.5 hours,"56.92790,-4.79820",https://www.walkhighlands.co.uk/fortwilliam/parallel-roads.shtml,1.5,Heritage,Fort William and Lochaber
"Achaderry and River Spean circuit, Roybridge",2,6km,1.5 - 2 hours,"56.89110,-4.84160",https://www.walkhighlands.co.uk/fortwilliam/roybridge.shtml,2,River,Fort William and Lochaber
"Coire Ŕrdair, Creag Meagaidh",2,12km,3.5 - 4.5 hours,"56.95200,-4.49590",https://www.walkhighlands.co.uk/fortwilliam/coire-ardair.shtml,4.5,Mountain,Fort William and Lochaber
"Beinn na Lap, from Corrour",3,10km,3 - 5 hours,"56.76040,-4.69070",https://www.walkhighlands.co.uk/fortwilliam/beinn-na-lap.shtml,5,Mountain,Fort William and Lochaber
"Beinn Iaruinn and Leana Mhor, Glen Roy",4,8.75km,4.5 - 5 hours,"56.95240,-4.79620",https://www.walkhighlands.co.uk/fortwilliam/beinn-iaruinn.shtml,5,Mountain,Fort William and Lochaber
"Cŕrn Dearg (Bhrunachain), Glen Roy",4,9km,4 - 6 hours,"56.97930,-4.74870",https://www.walkhighlands.co.uk/fortwilliam/carn-dearg-bhrunachain.shtml,6,Mountain,Fort William and Lochaber
"Leum Uilleim, from Corrour Station",4,9.75km,3 - 4.5 hours,"56.76020,-4.69060",https://www.walkhighlands.co.uk/fortwilliam/leum-uilleim.shtml,4.5,Mountain,Fort William and Lochaber
Cruach Innse and Sgůrr Innse,4,13km,6 - 7 hours,"56.86820,-4.86347",https://www.walkhighlands.co.uk/fortwilliam/cruach-innse.shtml,7,Mountain,Fort William and Lochaber
Chno Dearg and Stob Coire Sgriodain,4,13.5km,6 - 7 hours,"56.86550,-4.70850",https://www.walkhighlands.co.uk/fortwilliam/chnodearg.shtml,7,Mountain,Fort William and Lochaber
"The Eachach Cŕrn Deargs, Glen Roy",4,14km,5.5 - 6 hours,"56.98120,-4.74310",https://www.walkhighlands.co.uk/fortwilliam/carn-deargs-eachach.shtml,3,Mountain,Fort William and Lochaber
Beinn a' Chaorainn & Beinn Teallach,4,16km,6 - 8 hours,"56.89510,-4.66560",https://www.walkhighlands.co.uk/fortwilliam/beinnachaorainn.shtml,8,Mountain,Fort William and Lochaber
Stob Coire Easain and Stob a'Choire Mheadhoin,4,16.5km,7 - 8 hours,"56.86540,-4.70840",https://www.walkhighlands.co.uk/fortwilliam/easains.shtml,8,Mountain,Fort William and Lochaber
Stob Ban (Grey Corries),4,18km,6 - 7 hours,"56.86830,-4.86370",https://www.walkhighlands.co.uk/fortwilliam/stob-ban-grey-corries.shtml,7,Mountain,Fort William and Lochaber
Creag Meagaidh circuit,4,21km,8 - 10 hours,"56.95210,-4.49592",https://www.walkhighlands.co.uk/fortwilliam/creagmeagaidh.shtml,10,Mountain,Fort William and Lochaber
The Grey Corries,4,21.5km,9 - 10 hours,"56.87270,-4.86820",https://www.walkhighlands.co.uk/fortwilliam/greycorries.shtml,10,Mountain,Fort William and Lochaber
Sgňr Gaibhre and Cŕrn Dearg from Corrour,4,21.75km,7 - 8 hours,"56.76040,-4.69070",https://www.walkhighlands.co.uk/fortwilliam/sgor-gaibhre.shtml,8,Mountain,Fort William and Lochaber
"Beinn a' Chlachair, Geal Chŕrn & Creag Pitridh",4,26km,8 - 10 hours,"56.91220,-4.57556",https://www.walkhighlands.co.uk/fortwilliam/beinn-a-chlachair.shtml,10,Mountain,Fort William and Lochaber
Ballachulish Slate Quarries and Loch Leven,1,2km,45 mins - 1 hour,"56.67830,-5.13011",https://www.walkhighlands.co.uk/fortwilliam/ballachulish.shtml,1,Heritage,Fort William and Lochaber
"Signal Rock and An Torr, Glencoe",1,2.5km,1 - 1.5 hours,"56.66190,-5.05696",https://www.walkhighlands.co.uk/fortwilliam/signalrock.shtml,1.5,Heritage,Fort William and Lochaber
Glencoe Lochan trails,1,2.5km,1 - 1.5 hours,"56.68780,-5.09663",https://www.walkhighlands.co.uk/fortwilliam/glencoelochan.shtml,1.5,Forest,Fort William and Lochaber
"Brecklet Trail, Ballachulish",1,3km,1 - 1.5 hours,"56.67830,-5.13011",https://www.walkhighlands.co.uk/fortwilliam/brecklet.shtml,1.5,Heritage,Fort William and Lochaber
"Inchree Falls, near Onich",1,5km,1.5 - 2.5 hours,"56.72050,-5.22132",https://www.walkhighlands.co.uk/fortwilliam/inchreefalls.shtml,2.5,River,Fort William and Lochaber
Glencoe Orbital path,1,12.75km,2 - 2.5 hours,"56.68170,-5.10590",https://www.walkhighlands.co.uk/fortwilliam/glencoe-orbital.shtml,2.5,River,Fort William and Lochaber
"Grey Mare's Tail & Mamore Lodge, Kinlochleven",2,3.5km,1.5 - 2.5 hours,"56.71680,-4.96280",https://www.walkhighlands.co.uk/fortwilliam/mamorelodge.shtml,2.5,Forest,Fort William and Lochaber
"The Two Lairigs, Glen Coe",2,15km,5 - 6 hours,"56.66270,-4.95820",https://www.walkhighlands.co.uk/fortwilliam/2-lairigs.shtml,6,Mountain,Fort William and Lochaber
"Blackwater Reservoir, Kinlochleven",2,17.5km,5 - 6 hours,"56.71270,-4.96299",https://www.walkhighlands.co.uk/fortwilliam/blackwater.shtml,6,River,Fort William and Lochaber
"Lost Valley (Coire Gabhail), Glen Coe",3,4km,2 - 3 hours,"56.66770,-4.98650",https://www.walkhighlands.co.uk/fortwilliam/lostvalley.shtml,3,Mountain,Fort William and Lochaber
The Pap of Glencoe,3,7km,3.5 - 5 hours,"56.68220,-5.09182",https://www.walkhighlands.co.uk/fortwilliam/papofglencoe.shtml,5,Mountain,Fort William and Lochaber
Buachaille Etive Beag,3,8km,5 - 6 hours,"56.66270,-4.95820",https://www.walkhighlands.co.uk/fortwilliam/buachailleetivebeag.shtml,6,Mountain,Fort William and Lochaber
"Beinn a' Chrůlaiste, from Altnafeidh",3,11km,4 - 5 hours,"56.66440,-4.90450",https://www.walkhighlands.co.uk/fortwilliam/beinn-a-chrulaiste.shtml,5,Mountain,Fort William and Lochaber
"Garbh Bheinn, Loch Leven",4,6km,4.5 - 6 hours,"56.70190,-5.03500",https://www.walkhighlands.co.uk/fortwilliam/garbh-bheinn-loch-leven.shtml,6,Mountain,Fort William and Lochaber
"Beinn Maol Chaluim, from Glen Etive",4,8km,5 - 6 hours,"56.60080,-5.01670",https://www.walkhighlands.co.uk/fortwilliam/beinn-maol-chaluim.shtml,6,Mountain,Fort William and Lochaber
Meall Dearg from the north,4,8.5km,5 - 6 hours,"56.70160,-5.03586",https://www.walkhighlands.co.uk/fortwilliam/meall-dearg.shtml,6,Mountain,Fort William and Lochaber
"Beinn Trilleachan, Glen Etive",4,8.75km,6 - 7 hours,"56.56880,-5.08120",https://www.walkhighlands.co.uk/fortwilliam/beinn-trilleachan.shtml,7,Mountain,Fort William and Lochaber
"Beinn Mhic Chasgaig, Glen Etive",4,9.75km,5.5 - 6 hours,"56.61810,-4.93960",https://www.walkhighlands.co.uk/fortwilliam/beinn-mhic-chasgaig.shtml,6,Mountain,Fort William and Lochaber
Creise and Meall a'Bhůiridh from the Ski centre,4,10.5km,5 - 7 hours,"56.63240,-4.82790",https://www.walkhighlands.co.uk/fortwilliam/creise.shtml,7,Mountain,Fort William and Lochaber
Bidean nam Bian,4,11km,7 - 9 hours,"56.66770,-4.98650",https://www.walkhighlands.co.uk/fortwilliam/bideannambian.shtml,9,Mountain,Fort William and Lochaber
"Stob Dubh, Glen Etive",4,11.5km,7.5 - 8 hours,"56.61810,-4.93960",https://www.walkhighlands.co.uk/fortwilliam/stob-dubh.shtml,8,Mountain,Fort William and Lochaber
Buachaille Etive Mňr,4,13km,7 - 9 hours,"56.66440,-4.90450",https://www.walkhighlands.co.uk/fortwilliam/buachailleetivemor.shtml,9,Mountain,Fort William and Lochaber
"Binnein Mňr and Na Gruagaichean, Mamores",4,14km,7 - 9 hours,"56.71690,-4.96308",https://www.walkhighlands.co.uk/fortwilliam/binneinmor.shtml,9,Mountain,Fort William and Lochaber
Sgňr na h-Ulaidh and Meall Lighiche,4,15.5km,7 - 9 hours,"56.66110,-5.06878",https://www.walkhighlands.co.uk/fortwilliam/sgornaulaidh.shtml,9,Mountain,Fort William and Lochaber
Beinn a' Bheithir via Schoolhouse Ridge,4,15.5km,7 - 9 hours,"56.67830,-5.12981",https://www.walkhighlands.co.uk/fortwilliam/beinnabheithir.shtml,9,Mountain,Fort William and Lochaber
"Beinn nan Aighenan, Glen Etive",4,15.75km,7 - 9 hours,"56.57650,-5.03520",https://www.walkhighlands.co.uk/fortwilliam/beinn-nan-aighenan.shtml,9,Mountain,Fort William and Lochaber
Ben Starav and Glas Bheinn Mhňr,4,16km,8 - 9 hours,"56.57620,-5.03566",https://www.walkhighlands.co.uk/fortwilliam/benstarav.shtml,9,Mountain,Fort William and Lochaber
Stob Coir'an Albannaich and Meall nan Eun,4,18km,7 - 9 hours,"56.57620,-5.03566",https://www.walkhighlands.co.uk/fortwilliam/stobcoiranalbannaich.shtml,9,Mountain,Fort William and Lochaber
"Mam na Gualainn circuit, Kinlochleven",4,19.5km,7 - 8 hours,"56.71670,-4.96290",https://www.walkhighlands.co.uk/fortwilliam/mam-na-gualainn.shtml,8,Mountain,Fort William and Lochaber
"Sgůrr Čilde Mňr and Binnein Beag, Mamores",4,20km,9 - 11 hours,"56.71680,-4.96280",https://www.walkhighlands.co.uk/fortwilliam/sgurreildemor.shtml,11,Mountain,Fort William and Lochaber
Glas Bheinn from Kinlochleven,4,20.75km,7 - 8 hours,"56.71690,-4.96308",https://www.walkhighlands.co.uk/fortwilliam/glas-bheinn.shtml,8,Mountain,Fort William and Lochaber
"Fraochaidh, from Ballachulish",4,21km,7 - 8 hours,"56.67830,-5.12979",https://www.walkhighlands.co.uk/fortwilliam/fraochaidh.shtml,8,Mountain,Fort William and Lochaber
Aonach Eagach,5,9.5km,8 - 9 hours,"56.66660,-4.98240",https://www.walkhighlands.co.uk/fortwilliam/aonacheagach.shtml,9,Mountain,Fort William and Lochaber
"Daingean Trail, Glengarry",1,0.75km,45 minutes,"57.08560,-4.90784",https://www.walkhighlands.co.uk/fortwilliam/daingean.shtml,0.75,Forest,Fort William and Lochaber
"Allt Muick butterfly reserve, Loch Arkaig",1,1.75km,1 hour,"56.97310,-5.09400",https://www.walkhighlands.co.uk/fortwilliam/allt-muick.shtml,1,River,Fort William and Lochaber
"Ciste Dubh Trail, near Invergarry",1,3km,45 mins - 1 hour,"57.07130,-4.83329",https://www.walkhighlands.co.uk/fortwilliam/gleannlaogh.shtml,1,River,Fort William and Lochaber
"Allt na Calliche Trail, near Invergarry",1,4.5km,1.5 - 2 hours,"57.07130,-4.83329",https://www.walkhighlands.co.uk/fortwilliam/alltnacalliche.shtml,2,Forest,Fort William and Lochaber
"Glen Loy Oakwood, near Gairlochy",1,4.5km,1 - 2 hours,"56.89330,-5.04010",https://www.walkhighlands.co.uk/fortwilliam/glenloy.shtml,2,Forest,Fort William and Lochaber
"Knoydart in a Knutshell, Inverie",1,5km,1 - 1.5 hours,"57.03830,-5.68520",https://www.walkhighlands.co.uk/fortwilliam/knoydart-knutshell.shtml,1.5,Coastal,Fort William and Lochaber
"Loch Lundie, Invergarry",1,5km,1 - 1.5 hours,"57.06980,-4.81180",https://www.walkhighlands.co.uk/fortwilliam/loch-lundie.shtml,1.5,Wetland,Fort William and Lochaber
"River Garry, Invergarry",1,5.75km,2 hours,"57.06840,-4.80415",https://www.walkhighlands.co.uk/fortwilliam/invergarry.shtml,2,Heritage,Fort William and Lochaber
"Loch Lochy and the Canal, from Gairlochy",1,6.5km,2 hours,"57.06840,-4.80415",https://www.walkhighlands.co.uk/fortwilliam/gairlochy.shtml,2,River,Fort William and Lochaber
Loch Arkaig and Invermallie,1,9km,2.5 - 3 hours,"56.95480,-4.99989",https://www.walkhighlands.co.uk/fortwilliam/locharkaig.shtml,3,Wetland,Fort William and Lochaber
Barrisdale Bay walk-in from Kinloch Hourn,2,10.75km,3.5 - 4.5 hours one way,"57.10460,-5.38630",https://www.walkhighlands.co.uk/fortwilliam/barrisdale-bay.shtml,4.5,Coastal,Fort William and Lochaber
"Loch Oich circuit, Invergarry",2,17.2km,4.5 - 6 hours,"57.06840,-4.80386",https://www.walkhighlands.co.uk/fortwilliam/lochoich.shtml,6,River,Fort William and Lochaber
"Beinn Bhan, Glen Loy",3,8.5km,4 - 5 hours,"56.90150,-5.07930",https://www.walkhighlands.co.uk/fortwilliam/beinn-bhan.shtml,5,Mountain,Fort William and Lochaber
"Ben Tee, Kilfinnan",3,10km,4 - 6 hours,"57.02140,-4.83904",https://www.walkhighlands.co.uk/fortwilliam/bentee.shtml,6,Mountain,Fort William and Lochaber
"Inverie, Sandaig and Doune circuit: the Knoydart Coast",3,19km,6.5 - 7 hours,"57.03830,-5.68520",https://www.walkhighlands.co.uk/fortwilliam/inverie-sandaig-doune.shtml,7,Coastal,Fort William and Lochaber
"Sgůrr nan Eugallt, near Kinloch Hourn",4,9.5km,4.5 - 5 hours,"57.09530,-5.37140",https://www.walkhighlands.co.uk/fortwilliam/sgurr-nan-eugallt.shtml,5,Mountain,Fort William and Lochaber
"Sgůrr a' Choire-bheithe, from Barrisdale Bay",4,9.75km,4.5 - 5.5 hours,"57.07960,-5.51340",https://www.walkhighlands.co.uk/fortwilliam/sgurr-a-choire-bheithe.shtml,5.5,Mountain,Fort William and Lochaber
Gleouraich and Spidean Mialach,4,12km,5 - 7 hours,"57.07570,-5.25320",https://www.walkhighlands.co.uk/fortwilliam/spideanmialach.shtml,7,Mountain,Fort William and Lochaber
"Buidhe Bheinn, from Kinloch Hourn",4,12km,5.5 - 6 hours,"57.10460,-5.38630",https://www.walkhighlands.co.uk/fortwilliam/buidhe-bheinn.shtml,6,Mountain,Fort William and Lochaber
"Sgůrr Coire Choinnichean, from Inverie",4,12.75km,5.5 - 6 hours,"57.03830,-5.68520",https://www.walkhighlands.co.uk/fortwilliam/sgurr-coire-choinnichean.shtml,6,Mountain,Fort William and Lochaber
"Sgůrr Cos na Breachd-laoidh, Loch Arkaig",4,13km,6 - 7 hours,"56.97150,-5.31220",https://www.walkhighlands.co.uk/fortwilliam/sgurr-cos-na-breachd-laoidh.shtml,7,Mountain,Fort William and Lochaber
"Sgůrr a' Mhaoraich, Loch Cuaich",4,14km,5 - 7 hours,"57.08480,-5.27810",https://www.walkhighlands.co.uk/fortwilliam/sgurramhaoraich.shtml,7,Mountain,Fort William and Lochaber
"Sgůrr Mhurlagain and Fraoch Bheinn, Loch Arkaig",4,15km,6.5 - 8 hours,"56.97160,-5.31220",https://www.walkhighlands.co.uk/fortwilliam/sgurr-mhurlagain.shtml,8,Mountain,Fort William and Lochaber
"Meall a' Phůbuill, from Glen Loy",4,15km,5 - 6 hours,"56.91460,-5.13380",https://www.walkhighlands.co.uk/fortwilliam/meall-a-phubuill.shtml,6,Mountain,Fort William and Lochaber
"Gairich, Loch Cuaich",4,15.5km,5 - 7 hours,"57.07190,-5.18770",https://www.walkhighlands.co.uk/fortwilliam/gairich.shtml,7,Mountain,Fort William and Lochaber
"Meall na h-Eilde and Geal Charn, Loch Arkaig",4,17km,6.5 - 7 hours,"56.95760,-5.03209",https://www.walkhighlands.co.uk/fortwilliam/meall-na-h-eilde.shtml,7,Mountain,Fort William and Lochaber
Loch Lochy Munros from Kilfinnan,4,19km,7 - 9 hours,"57.02130,-4.83917",https://www.walkhighlands.co.uk/fortwilliam/lochlochymunros.shtml,9,Mountain,Fort William and Lochaber
"Beinn Bhuidhe, from Inverie",4,19.5km,7 - 9 hours,"57.03830,-5.68520",https://www.walkhighlands.co.uk/fortwilliam/beinn-bhuidhe-knoydart.shtml,9,Mountain,Fort William and Lochaber
"Cŕrn Mňr , from Loch Arkaig",4,21km,6.5 - 7.5 hours,"56.97140,-5.31240",https://www.walkhighlands.co.uk/fortwilliam/carn-mor.shtml,7.5,Mountain,Fort William and Lochaber
"Beinn na Caillich, from Inverie",4,21.5km,8 - 9 hours,"57.03830,-5.68520",https://www.walkhighlands.co.uk/fortwilliam/beinn-na-caillich-knoydart.shtml,9,Mountain,Fort William and Lochaber
"Sgůrr Mňr and Sgůrr an Fhuarain, Loch Arkaig",4,24km,9 - 11 hours,"56.97190,-5.31230",https://www.walkhighlands.co.uk/fortwilliam/sgurr-mor.shtml,11,Mountain,Fort William and Lochaber
Bidein a' Chabair from Loch Arkaig,4,26km,9 - 10 hours,"56.97190,-5.31230",https://www.walkhighlands.co.uk/fortwilliam/bidein-a-chabair.shtml,10,Mountain,Fort William and Lochaber
Sgůrr na Cěche: 3 Munros from Loch Arkaig,4,26km,10 - 12 hours,"56.97190,-5.31230",https://www.walkhighlands.co.uk/fortwilliam/sgurrnaciche.shtml,12,Mountain,Fort William and Lochaber
"Ladhar Bheinn from Inverie, Knoydart",5,22.5km,9 - 12 hours,"57.03860,-5.68540",https://www.walkhighlands.co.uk/fortwilliam/ladhar-bheinn.shtml,12,Mountain,Fort William and Lochaber
"Ben Aden, by Loch Cuaich",5,26.75km,11 - 13 hours,"57.07860,-5.31200",https://www.walkhighlands.co.uk/fortwilliam/ben-aden.shtml,13,Mountain,Fort William and Lochaber
"Luinne Bheinn and Meall Bhuidhe, Inverie, Knoydart",5,27km,11 - 13 hours,"57.03860,-5.68540",https://www.walkhighlands.co.uk/fortwilliam/luinne-bheinn.shtml,13,Mountain,Fort William and Lochaber
"Sailean nan Cuileag, Sunart Oakwoods",1,0.75km,30 mins,"56.71430,-5.75693",https://www.walkhighlands.co.uk/fortwilliam/saileannancuileag.shtml,0.5,Coastal,Fort William and Lochaber
Salen Oakwoods,1,1.5km,45 mins - 1 hour,"56.71530,-5.77430",https://www.walkhighlands.co.uk/fortwilliam/salen.shtml,1,Forest,Fort William and Lochaber
"Ŕrd Airigh and Garbh Eilean hide, Sunart Oakwoods",1,1.5km,1 hour,"56.69430,-5.68242",https://www.walkhighlands.co.uk/fortwilliam/ardairigh.shtml,1,Coastal,Fort William and Lochaber
Glenborrodale RSPB reserve,1,2.75km,1 hour,"56.67760,-5.91770",https://www.walkhighlands.co.uk/fortwilliam/glenborrodale.shtml,1,Forest,Fort William and Lochaber
"Aoineadh Mňr Cleared Village, Morvern",1,3.25km,1-1.5 hours,"56.59960,-5.80050",https://www.walkhighlands.co.uk/fortwilliam/inniemore.shtml,1.5,Heritage,Fort William and Lochaber
Corran Narrows and Clovullin,1,3.6km,1 hour,"56.72260,-5.24360",https://www.walkhighlands.co.uk/fortwilliam/corran-narrows.shtml,1,Coastal,Fort William and Lochaber
"Loch Shiel viewpoints walk, Polloch",1,4.5km,1.5 hours,"56.75850,-5.61350",https://www.walkhighlands.co.uk/fortwilliam/loch-shiel.shtml,1.5,River,Fort William and Lochaber
"Eilean Fhianain, Dalelia",1,4.5km,1.5 hours,"56.75850,-5.70890",https://www.walkhighlands.co.uk/fortwilliam/eilean-fhianain.shtml,1.5,Heritage,Fort William and Lochaber
Ariundle Oakwoods circular,1,4.75km,1.5 - 2 hours,"56.71100,-5.55420",https://www.walkhighlands.co.uk/fortwilliam/ariundle-oakwoods.shtml,2,Forest,Fort William and Lochaber
"Singing Sands, near Kentra",1,9.5km,2.5 - 3.5 hours,"56.74130,-5.84496",https://www.walkhighlands.co.uk/fortwilliam/singingsands.shtml,3.5,Coastal,Fort William and Lochaber
"Ardtornish Old Castle, near Lochaline",1,13.5km,3 - 4 hours,"56.56170,-5.73757",https://www.walkhighlands.co.uk/fortwilliam/ardtornish-castle.shtml,4,Heritage,Fort William and Lochaber
"Prince's Walk, Kinlochmoidart",2,3km,1 hour,"56.78960,-5.75110",https://www.walkhighlands.co.uk/fortwilliam/princeswalk.shtml,1,Heritage,Fort William and Lochaber
"Aird Molach circuit, near Kinlochmoidart",2,3.75km,1 - 1.5 hours,"56.77800,-5.74070",https://www.walkhighlands.co.uk/fortwilliam/ardmolich.shtml,1.5,Forest,Fort William and Lochaber
Smirisary village and beach from Glen Uig,2,4.5km,2.5 - 3.5 hours,"56.82830,-5.84702",https://www.walkhighlands.co.uk/fortwilliam/smirisary.shtml,3.5,Coastal,Fort William and Lochaber
