Walk,Grade,Length,Time,GPS START,Link,Hours,Biome,Region
"Achadun Castle, from Achnacroish",1,13km,3.5 - 4 hours,"56.51130,-5.49260",https://www.walkhighlands.co.uk/argyll/achadun-castle.shtml,4,Heritage,"Argyll, Bute and Oban walks"
Port Ramsay Circuit (Lismore),2,4.7km,1.5 hours,"56.55990,-5.42810",https://www.walkhighlands.co.uk/argyll/port-ramsay.shtml,1.5,Coastal,"Argyll, Bute and Oban walks"
Tirefour Broch and Castle Coeffin from Achnacroish,2,10.8km,3 - 4 hours,"56.51130,-5.49260",https://www.walkhighlands.co.uk/argyll/tirefour-broch.shtml,4,Heritage,"Argyll, Bute and Oban walks"
Castle Coeffin and Tirefour Broch from Point,2,15.25km,4 - 4.5 hours,"56.55990,-5.42810",https://www.walkhighlands.co.uk/argyll/castle-coeffin.shtml,4.5,Heritage,"Argyll, Bute and Oban walks"
"Flanders Moss National Nature Reserve, near Kippen",1,0.9km,30 minutes,"56.15360,-4.17845",https://www.walkhighlands.co.uk/lochlomond/flanders-moss.shtml,0.5,Wetland,Loch Lomond and the Trossachs
Inversnaid RSPB nature trail,1,2.5km,1 hour,"56.24300,-4.68550",https://www.walkhighlands.co.uk/lochlomond/inversnaid.shtml,1,Forest,Loch Lomond and the Trossachs
Loch Drunkie,1,3.25km,1 hour,"56.21130,-4.36318",https://www.walkhighlands.co.uk/lochlomond/loch-drunkie.shtml,1,Wetland,Loch Lomond and the Trossachs
Achray Water circular,1,4.5km,1.5 - 2 hours,"56.23070,-4.41210",https://www.walkhighlands.co.uk/lochlomond/achray-water.shtml,2,River,Loch Lomond and the Trossachs
"Bracklinn Falls, Callander",1,5.25km,1.5 hours,"56.24780,-4.20120",https://www.walkhighlands.co.uk/lochlomond/bracklinn-falls.shtml,1.5,River,Loch Lomond and the Trossachs
"Lochan Spling, Aberfoyle",1,6km,1.5 hours,"56.17810,-4.38320",https://www.walkhighlands.co.uk/lochlomond/lochan-spling.shtml,1.5,Wetland,Loch Lomond and the Trossachs
"Doon Hill and Fairy Knowe, Aberfoyle",1,6.5km,2 hours,"56.17810,-4.38320",https://www.walkhighlands.co.uk/lochlomond/doon-hill.shtml,2,Forest,Loch Lomond and the Trossachs
"Loch Ŕrd and Ghleannain Loch, near Aberfoyle",1,6.75km,1.5 - 2.5 hours,"56.17860,-4.41980",https://www.walkhighlands.co.uk/lochlomond/loch-ard.shtml,2.5,Wetland,Loch Lomond and the Trossachs
Loch Venachar forestry walk,1,7km,2 hours,"56.22200,-4.27150",https://www.walkhighlands.co.uk/lochlomond/loch-venachar.shtml,2,Wetland,Loch Lomond and the Trossachs
Callander to Falls of Leny circuit,1,7.5km,2 - 3 hours,"56.24420,-4.21870",https://www.walkhighlands.co.uk/lochlomond/callander-leny.shtml,3,River,Loch Lomond and the Trossachs
Bochastle and the Falls of Leny,1,7.5km,2 hours,"56.24520,-4.24870",https://www.walkhighlands.co.uk/lochlomond/falls-of-leny.shtml,2,River,Loch Lomond and the Trossachs
Leannach Forest circuit,1,8km,2 - 2.5 hours,"56.21300,-4.39400",https://www.walkhighlands.co.uk/lochlomond/leannach.shtml,2.5,Forest,Loch Lomond and the Trossachs
Kinlochard and the Crannog,1,12km,3 - 4 hours,"56.18550,-4.50370",https://www.walkhighlands.co.uk/lochlomond/kinlochard.shtml,4,Forest,Loch Lomond and the Trossachs
Great Trossachs Path 2: Trossachs Pier to Callander,1,19km,4.5 - 5.5 hours,"56.23340,-4.42840",https://www.walkhighlands.co.uk/lochlomond/great-trossachs-path-2.shtml,5.5,Wetland,Loch Lomond and the Trossachs
Loch Katrine,1,21km,4.5 - 5.5 hours,"56.25760,-4.57790",https://www.walkhighlands.co.uk/lochlomond/loch-katrine.shtml,5.5,Wetland,Loch Lomond and the Trossachs
Ben A'an,2,3.7km,2 - 4 hours,"56.23270,-4.40650",https://www.walkhighlands.co.uk/lochlomond/ben-aan.shtml,4,Mountain,Loch Lomond and the Trossachs
Callander Crags,2,4km,1.5 - 2 hours,"56.24640,-4.20680",https://www.walkhighlands.co.uk/lochlomond/callander-craig.shtml,2,Mountain,Loch Lomond and the Trossachs
"Craigmore, near Aberfoyle",2,5.5km,2 - 2.5 hours,"56.18260,-4.38610",https://www.walkhighlands.co.uk/lochlomond/craigmore.shtml,2.5,Mountain,Loch Lomond and the Trossachs
Little Druim Wood and the Brig o' Turk loop,2,5.5km,2 hours,"56.22660,-4.34200",https://www.walkhighlands.co.uk/lochlomond/brig-o-turk.shtml,2,Forest,Loch Lomond and the Trossachs
"Lime Craig circuit, near Aberfoyle",2,6km,1.5 - 2.5 hours,"56.18260,-4.38610",https://www.walkhighlands.co.uk/lochlomond/highland-boundary-fault.shtml,2.5,Heritage,Loch Lomond and the Trossachs
"Lendrick Hill, near Brig o' Turk.",2,7.25km,2 - 3 hours,"56.22910,-4.34660",https://www.walkhighlands.co.uk/lochlomond/lendrick-hill.shtml,3,Mountain,Loch Lomond and the Trossachs
Stank Glen,2,8.5km,2.5 - 3.5 hours,"56.25340,-4.28220",https://www.walkhighlands.co.uk/lochlomond/stank-glen.shtml,3.5,Forest,Loch Lomond and the Trossachs
"Primrose Hill, Loch Katrine",2,11km,2.5 - 4 hours,"56.23330,-4.42860",https://www.walkhighlands.co.uk/lochlomond/primrose-hill.shtml,4,Forest,Loch Lomond and the Trossachs
"Loch Venachar circuit, near Brig o'Turk",2,19km,4.5 - 5 hours,"56.22910,-4.34670",https://www.walkhighlands.co.uk/lochlomond/venachar-circuit.shtml,5,Wetland,Loch Lomond and the Trossachs
Great Trossachs Path: Inversnaid to Trossachs pier,2,28.5km,7.5 - 8 hours,"56.24300,-4.68520",https://www.walkhighlands.co.uk/lochlomond/great-trossachs-path-1.shtml,8,Wetland,Loch Lomond and the Trossachs
Ben Ledi,3,10km,4 - 6 hours,"56.25340,-4.28220",https://www.walkhighlands.co.uk/lochlomond/ben-ledi.shtml,6,Mountain,Loch Lomond and the Trossachs
Ledard Farm to Loch Achray,3,10.5km,4 - 6 hours,"56.18790,-4.48390",https://www.walkhighlands.co.uk/lochlomond/ledard-achray.shtml,6,Mountain,Loch Lomond and the Trossachs
Ben Venue from Ledard Farm,3,11.5km,5 - 6 hours,"56.18790,-4.48390",https://www.walkhighlands.co.uk/lochlomond/ledard.shtml,6,Mountain,Loch Lomond and the Trossachs
Ben Venue from Loch Achray,3,14km,5 - 6 hours,"56.23070,-4.41210",https://www.walkhighlands.co.uk/lochlomond/ben-venue.shtml,6,Mountain,Loch Lomond and the Trossachs
"The Mell circuit, Glen Finglas",3,27km,6.5 - 7 hours,"56.22900,-4.34670",https://www.walkhighlands.co.uk/lochlomond/glen-finglas.shtml,7,Mountain,Loch Lomond and the Trossachs
"Beinn a' Choin, near Inversnaid",4,8.75km,5 - 6 hours,"56.25070,-4.66720",https://www.walkhighlands.co.uk/lochlomond/beinn-a-choin.shtml,6,Mountain,Loch Lomond and the Trossachs
Falls of Falloch,1,0.6km,20 minutes,"56.34970,-4.69746",https://www.walkhighlands.co.uk/lochlomond/falls-of-falloch.shtml,0.33,River,Loch Lomond and the Trossachs
"Mountain lookout trail, Crianlarich",1,2km,45 minutes,"56.39250,-4.61620",https://www.walkhighlands.co.uk/lochlomond/crianlarich.shtml,0.75,Forest,Loch Lomond and the Trossachs
"Tarbet Isle Walk, near Tarbet",1,2km,45 mins,"56.21150,-4.70000",https://www.walkhighlands.co.uk/lochlomond/tarbet-isle.shtml,0.75,Coastal,Loch Lomond and the Trossachs
Arrochar - Tarbet link path,1,2.25km,1 hour (one way),"56.20600,-4.74480",https://www.walkhighlands.co.uk/lochlomond/arrochar-tarbet.shtml,1,Forest,Loch Lomond and the Trossachs
Ardgartan shore and woodlands,1,3.5km,1 hour,"56.19440,-4.79120",https://www.walkhighlands.co.uk/lochlomond/ardgarten.shtml,1,Forest,Loch Lomond and the Trossachs
"Succoth Circuit, Arrochar",1,3.75km,1 - 1.5 hours,"56.20590,-4.75110",https://www.walkhighlands.co.uk/lochlomond/succoth.shtml,1.5,Forest,Loch Lomond and the Trossachs
"Glen Loin and Coiregrograin, Arrochar",2,17.5km,4 - 5.5 hours,"56.20600,-4.74480",https://www.walkhighlands.co.uk/lochlomond/glen-loin.shtml,5.5,Mountain,Loch Lomond and the Trossachs
Beinn Luibhean,3,4.5km,3 - 4 hours,"56.21410,-4.83510",https://www.walkhighlands.co.uk/lochlomond/beinn-luibhean.shtml,4,Mountain,Loch Lomond and the Trossachs
"Ben Donich, via Rest and Be Thankful",3,7.5km,3.5 - 4.5 hours,"56.22190,-4.85990",https://www.walkhighlands.co.uk/lochlomond/ben-donich.shtml,4.5,Mountain,Loch Lomond and the Trossachs
"The Cobbler, Arrochar",3,11km,4 - 6 hours,"56.20600,-4.75070",https://www.walkhighlands.co.uk/lochlomond/the-cobbler.shtml,6,Mountain,Loch Lomond and the Trossachs
Beinn an Lochain,4,5.5km,3 - 5 hours,"56.23910,-4.85120",https://www.walkhighlands.co.uk/lochlomond/beinn-an-lochain.shtml,5,Mountain,Loch Lomond and the Trossachs
Stob Coire Creagach (Binnein an Fhidhleir),4,7km,3 - 5 hours,"56.24570,-4.85090",https://www.walkhighlands.co.uk/lochlomond/stob-coire-creagach.shtml,5,Mountain,Loch Lomond and the Trossachs
"Beinn nan Imirean, from Auchessan",4,11km,5 - 6 hours,"56.41480,-4.51720",https://www.walkhighlands.co.uk/lochlomond/beinn-nan-imirean.shtml,6,Mountain,Loch Lomond and the Trossachs
"Ben Vane, from Inveruglas",4,11km,4.5 - 6.5 hours,"56.25160,-4.70884",https://www.walkhighlands.co.uk/lochlomond/ben-vane.shtml,6.5,Mountain,Loch Lomond and the Trossachs
Ben More and Stob Binnein,4,12km,6 - 8 hours,"56.40280,-4.56120",https://www.walkhighlands.co.uk/lochlomond/ben-more.shtml,8,Mountain,Loch Lomond and the Trossachs
"Beinn Chabhair, from Inverarnan",4,13km,5 - 6.5 hours,"56.32850,-4.72180",https://www.walkhighlands.co.uk/lochlomond/beinn-chabhair.shtml,6.5,Mountain,Loch Lomond and the Trossachs
Ben Vorlich via Loch Sloy,4,13.5km,5 - 6.5 hours,"56.25160,-4.70884",https://www.walkhighlands.co.uk/lochlomond/ben-vorlich-lomond.shtml,6.5,Mountain,Loch Lomond and the Trossachs
Beinn Narnain and Beinn Ěme,4,13.5km,6 - 7 hours,"56.20600,-4.75070",https://www.walkhighlands.co.uk/lochlomond/beinn-ime.shtml,7,Mountain,Loch Lomond and the Trossachs
"An Caisteal and Beinn a'Chrňin, near Crianlarich",4,14km,5.5 - 7 hours,"56.37900,-4.64300",https://www.walkhighlands.co.uk/lochlomond/an-caisteal.shtml,7,Mountain,Loch Lomond and the Trossachs
"Meall an Fhudair, near Inverarnan",4,14.5km,5 - 6 hours,"56.33960,-4.72095",https://www.walkhighlands.co.uk/lochlomond/meall-an-fhudair.shtml,6,Mountain,Loch Lomond and the Trossachs
Meall Glas and Sgiath Chuil from Glen Dochart,4,15.5km,7 - 9 hours,"56.41480,-4.51720",https://www.walkhighlands.co.uk/lochlomond/meall-glas.shtml,9,Mountain,Loch Lomond and the Trossachs
"The Brack and Cnoc Cňinnich , Ardgartan",4,15.5km,6 - 7.5 hours,"56.19460,-4.79130",https://www.walkhighlands.co.uk/lochlomond/the-brack.shtml,7.5,Mountain,Loch Lomond and the Trossachs
"Loch Lomond Shores walk, Balloch",1,1km,30 minutes,"56.00460,-4.59370",https://www.walkhighlands.co.uk/lochlomond/lomond-shores.shtml,0.5,Wetland,Loch Lomond and the Trossachs
"Duncryne hill, by Gartocharn",1,1.25km,40 minutes,"56.03770,-4.51740",https://www.walkhighlands.co.uk/lochlomond/duncryne.shtml,0.66,Mountain,Loch Lomond and the Trossachs
Balmaha Millennium Forest path,1,2km,45 mins,"56.08600,-4.53810",https://www.walkhighlands.co.uk/lochlomond/balmaha.shtml,0.75,Wetland,Loch Lomond and the Trossachs
Luss Heritage Trail,1,2.5km,1 hour,"56.10240,-4.63970",https://www.walkhighlands.co.uk/lochlomond/luss.shtml,1,Heritage,Loch Lomond and the Trossachs
Inchcailloch island,1,3km,1 - 1.5 hours,"56.08240,-4.55110",https://www.walkhighlands.co.uk/lochlomond/inchcailloch.shtml,1.5,Forest,Loch Lomond and the Trossachs
Ardess History Trail,1,3km,1 hour,"56.15250,-4.64310",https://www.walkhighlands.co.uk/lochlomond/ardess.shtml,1,Forest,Loch Lomond and the Trossachs
"Ardmore Point, near Helensburgh",1,3.25km,45 minutes,"55.97150,-4.68609",https://www.walkhighlands.co.uk/lochlomond/ardmore-point.shtml,0.75,Coastal,Loch Lomond and the Trossachs
Balloch Castle Country Park,1,3.5km,1 hour,"56.01420,-4.58260",https://www.walkhighlands.co.uk/lochlomond/balloch-castle.shtml,1,Heritage,Loch Lomond and the Trossachs
"Sallochy Forest Trail, Sallochy",1,3.75km,1.5 hours,"56.12750,-4.60850",https://www.walkhighlands.co.uk/lochlomond/sallochy.shtml,1.5,Forest,Loch Lomond and the Trossachs
Sallochy to Rowardennan,1,4.5km,1.5 hours (one way),"56.12750,-4.60850",https://www.walkhighlands.co.uk/lochlomond/rowardennan.shtml,1.5,Forest,Loch Lomond and the Trossachs
"Helensburgh and Rhu explorer, Helensburgh",1,8.25km,2 - 2.5 hours,"56.01670,-4.72899",https://www.walkhighlands.co.uk/lochlomond/helensburgh-rhu.shtml,2.5,Coastal,Loch Lomond and the Trossachs
"Conic Hill, Balmaha",2,4km,2 - 3 hours,"56.08600,-4.53810",https://www.walkhighlands.co.uk/lochlomond/conic-hill.shtml,3,Mountain,Loch Lomond and the Trossachs
"Aspen Path, Cashel Forest",2,4.2km,1.5 - 2.5 hours,"56.11200,-4.57610",https://www.walkhighlands.co.uk/lochlomond/cashell.shtml,2.5,Forest,Loch Lomond and the Trossachs
"Tom na h-Airidh, Helensburgh",2,7.25km,2 - 3 hours,"56.01670,-4.72899",https://www.walkhighlands.co.uk/lochlomond/tom-na-h-airidh.shtml,3,Mountain,Loch Lomond and the Trossachs
"Beinn Dubh - Glen Striddle horseshoe, Luss",3,11.5km,3.5 - 5 hours,"56.10240,-4.63970",https://www.walkhighlands.co.uk/lochlomond/beinn-dubh.shtml,5,Mountain,Loch Lomond and the Trossachs
Ben Lomond,3,12km,4.5 - 5.5 hours,"56.15250,-4.64310",https://www.walkhighlands.co.uk/lochlomond/ben-lomond.shtml,5.5,Mountain,Loch Lomond and the Trossachs
"Doune Hill and Beinn Eich, from Luss",3,18.5km,6 - 6.5 hours,"56.10280,-4.63970",https://www.walkhighlands.co.uk/lochlomond/doune-hill.shtml,6.5,Mountain,Loch Lomond and the Trossachs
"Creag an Tuirc, Balquhidder",1,2.5km,1 hour,"56.35800,-4.37070",https://www.walkhighlands.co.uk/lochlomond/creag-an-tuirc.shtml,1,Forest,Loch Lomond and the Trossachs
Strathyre circuit,1,3km,1 hour,"56.32230,-4.33000",https://www.walkhighlands.co.uk/lochlomond/strathyre.shtml,1,Forest,Loch Lomond and the Trossachs
"Kirkton Glen, Balquhidder",1,9km,2 - 2.5 hours,"56.35800,-4.37070",https://www.walkhighlands.co.uk/lochlomond/kirkton-glen.shtml,2.5,Forest,Loch Lomond and the Trossachs
"Glen Ogle Trail, Lochearnhead",2,10.5km,3 - 4 hours,"56.38530,-4.28030",https://www.walkhighlands.co.uk/lochlomond/glen-ogle.shtml,4,Mountain,Loch Lomond and the Trossachs
Beinn Each from Loch Lubnaig,3,7km,3.5 - 4.5 hours,"56.29470,-4.29129",https://www.walkhighlands.co.uk/lochlomond/beinn-each.shtml,4.5,Mountain,Loch Lomond and the Trossachs
"Beinn an t-Sědhean, Strathyre",3,7.25km,2.5 - 3.5 hours,"56.32230,-4.33000",https://www.walkhighlands.co.uk/lochlomond/beinn-an-t-sidhean.shtml,3.5,Mountain,Loch Lomond and the Trossachs
"Benvane, from Glen Buckie",3,8.75km,4 - 5 hours,"56.32700,-4.38009",https://www.walkhighlands.co.uk/lochlomond/benvane.shtml,5,Mountain,Loch Lomond and the Trossachs
"Beinn Stacath, from Glen Buckie",3,12.75km,4.5 - 5.5 hours,"56.32700,-4.38009",https://www.walkhighlands.co.uk/lochlomond/beinn-stacath.shtml,5.5,Mountain,Loch Lomond and the Trossachs
Balquhidder to Brig O'Turk via Glen Finglas,3,14.5km,4 - 6 hours,"56.32700,-4.38020",https://www.walkhighlands.co.uk/lochlomond/balquhidder-turk.shtml,6,Mountain,Loch Lomond and the Trossachs
"Stob a' Choin, from Inverlochlarig",4,10.5km,6.5 - 7 hours,"56.33290,-4.51560",https://www.walkhighlands.co.uk/lochlomond/stob-a-choin.shtml,7,Mountain,Loch Lomond and the Trossachs
Cruach Ŕrdrain and Beinn Tulaichean,4,12.5km,6 - 7 hours,"56.33300,-4.51570",https://www.walkhighlands.co.uk/lochlomond/cruach-ardrain.shtml,7,Mountain,Loch Lomond and the Trossachs
Creag Mac Ranaich and Meall an t-Seallaidh,4,20.5km,7 - 8 hours,"56.38530,-4.28030",https://www.walkhighlands.co.uk/lochlomond/creag-mac-ranaich.shtml,8,Mountain,Loch Lomond and the Trossachs
The Isle of May,1,4km,1.5 - 2 hours,"56.18310,-2.54970",https://www.walkhighlands.co.uk/fife-stirling/isle-of-may.shtml,2,Coastal,Fife and Stirling walks
St Andrews - Town and Gown walk,1,5km,1.5 - 2 hours,"56.34150,-2.80760",https://www.walkhighlands.co.uk/fife-stirling/st-andrews.shtml,2,Heritage,Fife and Stirling walks
"Kingsbarns and Cambo circuit, Kingsbarns",1,5.25km,1 - 2 hours,"56.30310,-2.64490",https://www.walkhighlands.co.uk/fife-stirling/kingsbarns.shtml,2,Coastal,Fife and Stirling walks
Balmerino and Thornton circuit,1,5.25km,1.5 hours,"56.40980,-3.04270",https://www.walkhighlands.co.uk/fife-stirling/balmerino.shtml,1.5,Heritage,Fife and Stirling walks
"Tentsmuir Forest & dunes, near Leuchars",1,5.5km,1.5 - 2 hours,"56.40780,-2.81370",https://www.walkhighlands.co.uk/fife-stirling/tentsmuir.shtml,2,Forest,Fife and Stirling walks
Fife Coastal Path 6: St Monans to Anstruther,1,5.75km,1.5 - 2 hours,"56.20360,-2.77180",https://www.walkhighlands.co.uk/fife-stirling/st-monans-anstruther.shtml,2,Coastal,Fife and Stirling walks
Fife Coastal Path 7: Anstruther to Crail,1,6.75km,1.5 - 2 hours,"56.22300,-2.70080",https://www.walkhighlands.co.uk/fife-stirling/anstruther-crail.shtml,2,Coastal,Fife and Stirling walks
"West Sands, St Andrews",1,7.25km,2 - 2.5 hours,"56.34150,-2.80760",https://www.walkhighlands.co.uk/fife-stirling/west-sands.shtml,2.5,Coastal,Fife and Stirling walks
"Mount Hill and the Hopetoun Monument, Cupar",1,12.5km,3.5 - 4 hours,"56.32220,-3.02881",https://www.walkhighlands.co.uk/fife-stirling/mount-hill.shtml,4,Forest,Fife and Stirling walks
"Largo Law, from Upper Largo",2,3.25km,1.5 hours,"56.22260,-2.93216",https://www.walkhighlands.co.uk/fife-stirling/largo-law.shtml,1.5,Mountain,Fife and Stirling walks
"Craighall Den circular, Ceres",2,4km,1.5 hours,"56.29180,-2.97080",https://www.walkhighlands.co.uk/fife-stirling/ceres.shtml,1.5,Heritage,Fife and Stirling walks
"The Rock and Spindle, from St Andrews",2,4.75km,1.5 - 2 hours,"56.33330,-2.77960",https://www.walkhighlands.co.uk/fife-stirling/rock-and-spindle.shtml,2,Coastal,Fife and Stirling walks
"Norman's Law, from Luthrie",2,8.25km,2.5 - 3 hours,"56.36410,-3.08440",https://www.walkhighlands.co.uk/fife-stirling/normans-law.shtml,3,Mountain,Fife and Stirling walks
"Tay Bridge & Balmerino, from Wormit",2,8.5km,2 - 2.5 hours,"56.42220,-2.98760",https://www.walkhighlands.co.uk/fife-stirling/tay-bridge.shtml,2.5,Heritage,Fife and Stirling walks
Fife Coastal Path 8: Crail to Kingsbarns,2,9.5km,3 - 3.5 hours,"56.25870,-2.62850",https://www.walkhighlands.co.uk/fife-stirling/crail-kingsbarns.shtml,3.5,Coastal,Fife and Stirling walks
Hill of Tarvit and Scotstarvit from Ceres,2,10.25km,3 - 4 hours,"56.29180,-2.97080",https://www.walkhighlands.co.uk/fife-stirling/hill-of-tarvit.shtml,4,Heritage,Fife and Stirling walks
Fife Coastal Path 9: Kingsbarns to St Andrews,2,13.5km,3 - 4 hours,"56.30330,-2.64550",https://www.walkhighlands.co.uk/fife-stirling/kingsbarns-st-andrews.shtml,4,Coastal,Fife and Stirling walks
Fife Coastal Path 5: Lower Largo to St Monans,2,14km,3 - 4 hours,"56.21270,-2.93240",https://www.walkhighlands.co.uk/fife-stirling/largo-st-monans.shtml,4,Coastal,Fife and Stirling walks
"The Hill of Beath, near Cowdenbeath",1,2km,45 minutes,"56.09720,-3.37422",https://www.walkhighlands.co.uk/fife-stirling/hill-of-beath.shtml,0.75,Mountain,Fife and Stirling walks
"Dunfermline Explorer walk, Dunfermline",1,3.5km,1 hour,"56.06970,-3.47164",https://www.walkhighlands.co.uk/fife-stirling/dunfermline.shtml,1,Heritage,Fife and Stirling walks
"Maspie Den, Falkland",1,4.75km,1.5 - 2.5 hours,"56.25310,-3.20800",https://www.walkhighlands.co.uk/fife-stirling/maspie-den.shtml,2.5,Forest,Fife and Stirling walks
"Lochore Meadows circuit, near Lochgelly",1,5.25km,1- 1.5 hours,"56.15080,-3.33700",https://www.walkhighlands.co.uk/fife-stirling/lochore.shtml,1.5,Wetland,Fife and Stirling walks
North Queensferry coastal circuit,1,5.25km,2 hours,"56.00790,-3.39260",https://www.walkhighlands.co.uk/fife-stirling/north-queensferry.shtml,2,Heritage,Fife and Stirling walks
Tyndall Bruce Monument and Falkland Estate,1,6km,1.5 - 2 hours,"56.25380,-3.21680",https://www.walkhighlands.co.uk/fife-stirling/tyndall-bruce-monument.shtml,2,Forest,Fife and Stirling walks
"Auchtermuchty Common circuit, Auchtermuchty",1,7km,2 hours,"56.29110,-3.22942",https://www.walkhighlands.co.uk/fife-stirling/auchtermuchty.shtml,2,Heritage,Fife and Stirling walks
"Loch Leven Heritage Trail, Kinross",1,19.25km,5 - 6 hours,"56.20000,-3.41730",https://www.walkhighlands.co.uk/perthshire/loch-leven.shtml,6,Wetland,Fife and Stirling walks
"Craigluscar Hill, near Dunfermline",2,3.5km,1.5 hours,"56.09990,-3.51278",https://www.walkhighlands.co.uk/fife-stirling/craigluscar.shtml,1.5,Forest,Fife and Stirling walks
"Benarty Hill, near Ballingry",2,4.9km,1 - 1.5 hours,"56.15790,-3.35548",https://www.walkhighlands.co.uk/fife-stirling/benarty-hill.shtml,1.5,Mountain,Fife and Stirling walks
"Dumglow, Cleish Hills",2,5.5km,2 hours,"56.15710,-3.46080",https://www.walkhighlands.co.uk/fife-stirling/dumglow.shtml,2,Mountain,Fife and Stirling walks
"Lindores Loch circuit, Grange of Lindores",2,6km,2 - 2.5 hours,"56.33640,-3.20270",https://www.walkhighlands.co.uk/fife-stirling/lindores-loch.shtml,2.5,Wetland,Fife and Stirling walks
Bishop Hill circular from Scotlandwell,2,6.75km,2.5 - 3.5 hours,"56.20340,-3.31860",https://www.walkhighlands.co.uk/fife-stirling/bishop-hill-scotlandwell.shtml,3.5,Mountain,Fife and Stirling walks
"East Lomond circuit, Falkland",2,7km,2.5 - 3.5 hours,"56.25310,-3.20800",https://www.walkhighlands.co.uk/fife-stirling/east-lomond.shtml,3.5,Mountain,Fife and Stirling walks
St Ninians and Loch Fitty from Kingseat,2,7km,1.5 - 2 hours,"56.10020,-3.40660",https://www.walkhighlands.co.uk/fife-stirling/st-ninians-loch-fitty.shtml,2,Wetland,Fife and Stirling walks
Benarty Hill from Vane Farm,2,7.1km,2 - 3 hours,"56.17600,-3.35560",https://www.walkhighlands.co.uk/perthshire/benarty-vane-farm.shtml,3,Mountain,Fife and Stirling walks
West Lomond from Craigmead,2,8km,2.5 - 3.5 hours,"56.24180,-3.24770",https://www.walkhighlands.co.uk/fife-stirling/west-lomond.shtml,3.5,Mountain,Fife and Stirling walks
"The Binn and Kinghorn Loch, from Burntisland",2,10.5km,3 - 3.5 hours,"56.05920,-3.22927",https://www.walkhighlands.co.uk/fife-stirling/the-binn-burntisland.shtml,3.5,Mountain,Fife and Stirling walks
East Lomond from Glenrothes,2,10.5km,3 - 3.5 hours,"56.21830,-3.18450",https://www.walkhighlands.co.uk/fife-stirling/east-lomond-glenrothes.shtml,3.5,Mountain,Fife and Stirling walks
Bishop Hill circular from Holl Reservoir,2,12km,3 - 4 hours,"56.21780,-3.25270",https://www.walkhighlands.co.uk/fife-stirling/bishop-hill.shtml,4,Mountain,Fife and Stirling walks
West Lomond via the Bunnet Stane,3,9.25km,3.5 - 4 hours,"56.25910,-3.31740",https://www.walkhighlands.co.uk/fife-stirling/west-lomond-bunnet.shtml,4,Mountain,Fife and Stirling walks
"Saline Hill and Easter Cairn, Saline",3,9.5km,3 - 4 hours,"56.11480,-3.57419",https://www.walkhighlands.co.uk/fife-stirling/saline-hill.shtml,4,Mountain,Fife and Stirling walks
"Plean Country Park, Plean",1,2.5km,45 minutes,"56.05990,-3.88450",https://www.walkhighlands.co.uk/fife-stirling/plean-country-park.shtml,0.75,Forest,Fife and Stirling walks
Wallace Monument and Abbey Craig,1,2.5km,1 hour,"56.13970,-3.91980",https://www.walkhighlands.co.uk/fife-stirling/wallace-monument.shtml,1,Heritage,Fife and Stirling walks
Doune Castle and the River Teith,1,2.75km,1 hour,"56.18890,-4.05120",https://www.walkhighlands.co.uk/fife-stirling/doune.shtml,1,Heritage,Fife and Stirling walks
Culross - Heritage walk,1,4km,1 - 1.5 hours,"56.05540,-3.62320",https://www.walkhighlands.co.uk/fife-stirling/culross.shtml,1.5,Heritage,Fife and Stirling walks
Stirling Castle and Gowanhill,1,4.25km,1 hour,"56.11950,-3.93530",https://www.walkhighlands.co.uk/fife-stirling/stirling-castle.shtml,1,Heritage,Fife and Stirling walks
Darn Walk: Bridge of Allan to Dunblane,1,4.25km,1 - 1.5 hours,"56.15590,-3.95100",https://www.walkhighlands.co.uk/fife-stirling/darn-walk.shtml,1.5,River,Fife and Stirling walks
"Dunblane to Ashfield riverside walk, Dunblane",1,4.25km,1 - 1.5 hours,"56.18750,-3.96520",https://www.walkhighlands.co.uk/fife-stirling/dunblane-ashfield.shtml,1.5,River,Fife and Stirling walks
"Gartmorn Dam circuit, near Alloa",1,4.5km,1 - 1.5 hours,"56.12660,-3.75290",https://www.walkhighlands.co.uk/fife-stirling/gartmorn-dam.shtml,1.5,Wetland,Fife and Stirling walks
Dollar to Tillicoultry on the Devon Way,1,5km,1.25 hours,"56.16290,-3.67100",https://www.walkhighlands.co.uk/fife-stirling/dollar-tillicoultry.shtml,1.25,River,Fife and Stirling walks
"Bannockburn, near Stirling",1,5.25km,1.5 hours,"56.09250,-3.93500",https://www.walkhighlands.co.uk/fife-stirling/bannockburn.shtml,1.5,Heritage,Fife and Stirling walks
Cambuskenneth Abbey from Stirling,1,5.25km,1 - 1.5 hours,"56.11950,-3.93530",https://www.walkhighlands.co.uk/fife-stirling/cambuskenneth.shtml,1.5,Heritage,Fife and Stirling walks
Rumbling Bridge Gorge and Crook of Devon,1,5.75km,2 hours,"56.17770,-3.58540",https://www.walkhighlands.co.uk/fife-stirling/rumbling-bridge-gorge.shtml,2,River,Fife and Stirling walks
"Blairadam Forest walks, near Kelty",1,6.2km,1.5 - 2 hours,"56.13630,-3.40250",https://www.walkhighlands.co.uk/fife-stirling/blairadam.shtml,2,Forest,Fife and Stirling walks
"Mill Glen, Tillicoultry",2,2km,1 hour,"56.15710,-3.74920",https://www.walkhighlands.co.uk/fife-stirling/mill-glen.shtml,1,River,Fife and Stirling walks
Castle Campbell and Dollar Glen,2,3.7km,1.5 - 2 hours,"56.16340,-3.67156",https://www.walkhighlands.co.uk/fife-stirling/dollar-glen.shtml,2,River,Fife and Stirling walks
"Castlehill Trails, Glen Devon",2,4.25km,1.5 hours,"56.21140,-3.61890",https://www.walkhighlands.co.uk/fife-stirling/castlehill.shtml,1.5,Wetland,Fife and Stirling walks
"Airthrey Loch & Hermitage Woods, Stirling University",2,4.5km,1 - 1.5 hours,"56.14500,-3.92230",https://www.walkhighlands.co.uk/fife-stirling/stirling-university.shtml,1.5,Heritage,Fife and Stirling walks
"North Third Reservoir, near Stirling",2,4.75km,1.5 - 2 hours,"56.06860,-3.99900",https://www.walkhighlands.co.uk/fife-stirling/north-third.shtml,2,Wetland,Fife and Stirling walks
Clackmannan and the Towers,2,6.25km,1.5 - 2 hours,"56.10730,-3.75190",https://www.walkhighlands.co.uk/fife-stirling/clackmannan.shtml,2,Heritage,Fife and Stirling walks
Dumyat by the hill path,2,7km,2 - 2.5 hours,"56.15620,-3.91710",https://www.walkhighlands.co.uk/fife-stirling/dumyat.shtml,2.5,Mountain,Fife and Stirling walks
