Walk,Grade,Length,Time,GPS START,Link,Hours,Biome,Region
"Loch Ruthven, near Farr",1,1km,30 minutes,"57.32270,-4.26330",https://www.walkhighlands.co.uk/lochness/loch-ruthven.shtml,0.5,Wetland,"Loch Ness, Glen Affric & the Black Isle"
"Urquhart Bay Woods, Drumnadrochit",1,2km,45 minutes,"57.33190,-4.46830",https://www.walkhighlands.co.uk/lochness/Urquhartwoods.shtml,0.75,Forest,"Loch Ness, Glen Affric & the Black Isle"
"Allt na Criche, near Fort Augustus",1,2.5km,1 hour,"57.15970,-4.66310",https://www.walkhighlands.co.uk/lochness/Alltnacriche.shtml,1,Forest,"Loch Ness, Glen Affric & the Black Isle"
"Oak and Juniper paths, Dundreggan",1,2.5km,1 hour,"57.19220,-4.76302",https://www.walkhighlands.co.uk/lochness/dundreggan.shtml,1,Forest,"Loch Ness, Glen Affric & the Black Isle"
"Change House Walk, Erchite Wood, Inverfarigaig",1,3km,1 hour,"57.32380,-4.40820",https://www.walkhighlands.co.uk/lochness/change-house.shtml,1,Lochside,"Loch Ness, Glen Affric & the Black Isle"
"Daviot Wood circuit, Daviot",1,3.75km,1 hour,"57.42480,-4.13050",https://www.walkhighlands.co.uk/lochness/daviot.shtml,1,Valley,"Loch Ness, Glen Affric & the Black Isle"
Falls of Foyers,1,4.5km,1.5 - 2 hours,"57.25040,-4.49050",https://www.walkhighlands.co.uk/lochness/Fallsoffoyers.shtml,2,Gorge,"Loch Ness, Glen Affric & the Black Isle"
"Inverarnie Esker Trail, Littlemill near Daviot",1,4.75km,1.5 hours,"57.40100,-4.16390",https://www.walkhighlands.co.uk/lochness/littlemill.shtml,1.5,Valley,"Loch Ness, Glen Affric & the Black Isle"
"River Oich Trail, Fort Augustus",1,5.9km,1.5 - 2 hours,"57.14260,-4.70020",https://www.walkhighlands.co.uk/lochness/Riveroich.shtml,2,River,"Loch Ness, Glen Affric & the Black Isle"
"Loch Ness and Torr Woods circular, Dores",1,7km,1.5 - 2 hours,"57.38440,-4.32900",https://www.walkhighlands.co.uk/lochness/Aldourie.shtml,2,Forest,"Loch Ness, Glen Affric & the Black Isle"
Fort Augustus Explorer,1,7.75km,2 - 2.5 hours,"57.14640,-4.68160",https://www.walkhighlands.co.uk/lochness/fort-augustus.shtml,2.5,Canal,"Loch Ness, Glen Affric & the Black Isle"
"Jenkins Park, near Fort Augustus",1,7.8km,2 - 2.5 hours,"57.14910,-4.68370",https://www.walkhighlands.co.uk/lochness/Jenkinspark.shtml,2.5,Forest,"Loch Ness, Glen Affric & the Black Isle"
"Three Lochs circuit, south Loch Ness",1,10.3km,2 - 3 hours,"57.35910,-4.25010",https://www.walkhighlands.co.uk/lochness/Threelochs.shtml,3,Moorland,"Loch Ness, Glen Affric & the Black Isle"
"Old Coffin Road, near Abriachan",2,4km,1.5 hours,"57.36520,-4.39220",https://www.walkhighlands.co.uk/lochness/coffin-road.shtml,1.5,Moorland,"Loch Ness, Glen Affric & the Black Isle"
"Ceum an Fhraoich (Heather path), Dundreggan",2,4.25km,1.5 - 2 hours,"57.19220,-4.76302",https://www.walkhighlands.co.uk/lochness/ceum-an-fhraoich.shtml,2,Mountain,"Loch Ness, Glen Affric & the Black Isle"
"Cŕrn na h-Easgainn, near Moy",2,6.25km,2 - 3 hours,"57.37920,-4.05500",https://www.walkhighlands.co.uk/lochness/carn-na-h-easgainn.shtml,3,Mountain,"Loch Ness, Glen Affric & the Black Isle"
Abriachan Trails,2,9.2km,3 - 3.5 hours,"57.38630,-4.42970",https://www.walkhighlands.co.uk/lochness/Abriachan.shtml,3.5,Forest,"Loch Ness, Glen Affric & the Black Isle"
"Craigmonie and the Divach Falls, Drumnadrochit",2,10km,3 - 4 hours,"57.33530,-4.48000",https://www.walkhighlands.co.uk/lochness/Craigmonie.shtml,4,Forest,"Loch Ness, Glen Affric & the Black Isle"
Inverfarigaig and the Falls of Foyers,2,10.25km,3.5 - 4.5 hours,"57.28070,-4.45370",https://www.walkhighlands.co.uk/lochness/Inverfarigaig.shtml,4.5,Forest,"Loch Ness, Glen Affric & the Black Isle"
"Upper Findhorn moors and glens, Strathdearn",2,20.5km,5.5 - 6.5 hours,"57.23510,-4.13670",https://www.walkhighlands.co.uk/lochness/upper-findhorn.shtml,6.5,River,"Loch Ness, Glen Affric & the Black Isle"
"Srňn na Muic, Invermoriston",2,23.75km,5 - 6 hours,"57.21360,-4.61730",https://www.walkhighlands.co.uk/lochness/sron-na-muic.shtml,6,Mountain,"Loch Ness, Glen Affric & the Black Isle"
"Meall Fuar-mhonaidh, near Drumnadrochit",3,9km,3 - 5 hours,"57.28010,-4.50470",https://www.walkhighlands.co.uk/lochness/Mealfuarmhonaidh.shtml,5,Mountain,"Loch Ness, Glen Affric & the Black Isle"
"Cŕrn na Saobhaidhe, via Dunmaglass",3,26.5km,7 - 7.5 hours,"57.28970,-4.31230",https://www.walkhighlands.co.uk/lochness/carn-na-saobhaidhe.shtml,7.5,Mountain,"Loch Ness, Glen Affric & the Black Isle"
Corrieyairack Pass: Laggan to Fort Augustus,3,39.5km,10 - 12 hours,"57.01960,-4.28320",https://www.walkhighlands.co.uk/cairngorms/corrieyairack-pass.shtml,12,Mountain,"Loch Ness, Glen Affric & the Black Isle"
"Meall Dubh, from Glen Moriston",4,11km,4 - 5 hours,"57.16220,-4.88820",https://www.walkhighlands.co.uk/lochness/meall-dubh.shtml,5,Mountain,"Loch Ness, Glen Affric & the Black Isle"
"Cŕrn a' Chuilinn, via Glen Doe",4,17.25km,5 - 6 hours,"57.14280,-4.65210",https://www.walkhighlands.co.uk/lochness/carn-a-chuilinn.shtml,6,Mountain,"Loch Ness, Glen Affric & the Black Isle"
"River Affric and Am Meallan, Glen Affric",1,1.5km,45 minutes,"57.26520,-4.98460",https://www.walkhighlands.co.uk/lochness/Riveraffric.shtml,0.75,River,"Loch Ness, Glen Affric & the Black Isle"
"Plodda Falls, near Tomich",1,2.5km,1 hour,"57.27260,-4.85480",https://www.walkhighlands.co.uk/lochness/Ploddafalls.shtml,1,Forest,"Loch Ness, Glen Affric & the Black Isle"
Beauly Priory and river,1,2.75km,1 hour,"57.48350,-4.45989",https://www.walkhighlands.co.uk/lochness/beauly-priory.shtml,1,Heritage,"Loch Ness, Glen Affric & the Black Isle"
"Reelig Glen, Moniack",1,3.5km,1 - 1.5 hours,"57.45550,-4.40400",https://www.walkhighlands.co.uk/lochness/Reeligglen.shtml,1.5,Forest,"Loch Ness, Glen Affric & the Black Isle"
"Phoineas Hill, near Beauly",1,4.85km,1 - 2 hours,"57.44610,-4.46170",https://www.walkhighlands.co.uk/lochness/Phoineashill.shtml,2,Forest,"Loch Ness, Glen Affric & the Black Isle"
"Dog Falls and Coire Loch, Glen Affric",1,6km,1.5 - 2.5 hours,"57.31250,-4.85230",https://www.walkhighlands.co.uk/lochness/Dogfalls.shtml,2.5,Forest,"Loch Ness, Glen Affric & the Black Isle"
River Beauly and Lovat Bridge circuit,1,8km,2 - 2.5 hours,"57.46130,-4.50730",https://www.walkhighlands.co.uk/lochness/Beaulyriver.shtml,2.5,River,"Loch Ness, Glen Affric & the Black Isle"
Affric Kintail Way 3: Affric road end to Alltbeithe,2,14km,3.5 - 5 hours,"57.26520,-4.98460",https://www.walkhighlands.co.uk/lochness/Alltbeithe.shtml,5,Glen,"Loch Ness, Glen Affric & the Black Isle"
Loch Affric Circuit,2,18km,4.5 - 6.5 hours,"57.26520,-4.98460",https://www.walkhighlands.co.uk/lochness/Lochaffric.shtml,6.5,Lochside,"Loch Ness, Glen Affric & the Black Isle"
"Sgňrr na Diollaid, Glen Cannich",4,7km,4 - 5 hours,"57.35890,-4.85151",https://www.walkhighlands.co.uk/lochness/sgorr-na-diollaid.shtml,5,Mountain,"Loch Ness, Glen Affric & the Black Isle"
"Sgůrr a' Mhuilinn and Meallan nan Uan, Strathconon",4,13km,5 - 7 hours,"57.54820,-4.85200",https://www.walkhighlands.co.uk/lochness/sgurr-a-mhuilinn.shtml,7,Mountain,"Loch Ness, Glen Affric & the Black Isle"
Beinn a' Bha'ach Ŕrd,4,16km,6 - 7 hours,"57.42730,-4.67640",https://www.walkhighlands.co.uk/lochness/beinn-a-bha-ach-ard.shtml,7,Mountain,"Loch Ness, Glen Affric & the Black Isle"
"Tom a' Chňinich & Toll Creagach, Glen Affric",4,16.5km,6 - 8 hours,"57.27440,-4.95870",https://www.walkhighlands.co.uk/lochness/Tollcreagach.shtml,8,Mountain,"Loch Ness, Glen Affric & the Black Isle"
"An Sědhean from Loch Monar, Glen Strathfarrar",4,17km,6 - 7 hours,"57.40970,-4.99170",https://www.walkhighlands.co.uk/lochness/an-sidhean.shtml,7,Mountain,"Loch Ness, Glen Affric & the Black Isle"
"Sgůrr nan Ceathreamhnan group, Alltbeithe",4,20km,9 - 11 hours,"57.23220,-5.18340",https://www.walkhighlands.co.uk/lochness/Ceathreamhnan.shtml,11,Mountain,"Loch Ness, Glen Affric & the Black Isle"
"Bac an Eich, Strathconon",4,20.5km,6.5 - 7 hours,"57.52260,-4.96225",https://www.walkhighlands.co.uk/lochness/bac-an-eich.shtml,7,Mountain,"Loch Ness, Glen Affric & the Black Isle"
"Cŕrn a' Choire Ghairbh and Aonach Shasuinn, Affric",4,24.5km,9 - 10 hours,"57.26490,-4.98530",https://www.walkhighlands.co.uk/lochness/affric-corbetts.shtml,10,Mountain,"Loch Ness, Glen Affric & the Black Isle"
Glen Strathfarrar Munros circuit,4,25km,7 - 10 hours,"57.40560,-4.85910",https://www.walkhighlands.co.uk/lochness/strathfarrar-munros.shtml,10,Mountain,"Loch Ness, Glen Affric & the Black Isle"
Cŕrn Eige and Mam Sodhail,4,28km,10 - 13 hours,"57.27340,-4.96180",https://www.walkhighlands.co.uk/lochness/carn-eige.shtml,13,Mountain,"Loch Ness, Glen Affric & the Black Isle"
The Loch Mullardoch Munros,4,29.2km,11 - 14 hours,"57.33950,-4.95800",https://www.walkhighlands.co.uk/lochness/mullardoch-munros.shtml,14,Mountain,"Loch Ness, Glen Affric & the Black Isle"
"Rogie Falls circuit, near Contin",1,1.5km,1 hour,"57.59020,-4.60740",https://www.walkhighlands.co.uk/lochness/Rogiefalls.shtml,1,Forest,"Loch Ness, Glen Affric & the Black Isle"
"Fairy Glen, Rosemarkie",1,3.3km,1 hour,"57.59280,-4.11760",https://www.walkhighlands.co.uk/lochness/Fairyglen.shtml,1,Coastal,"Loch Ness, Glen Affric & the Black Isle"
"Silverbridge riverside circuit, near Garve",1,3.5km,1 - 1.5 hours,"57.63690,-4.67840",https://www.walkhighlands.co.uk/lochness/Silverbridge.shtml,1.5,Forest,"Loch Ness, Glen Affric & the Black Isle"
"Cnoc Croit na Maoile (Ord Hill), Muir of Ord",1,4km,1.5 - 2 hours,"57.49980,-4.50030",https://www.walkhighlands.co.uk/lochness/Ordhill.shtml,2,Forest,"Loch Ness, Glen Affric & the Black Isle"
"Eathie coast, near Rosemarkie",1,4.5km,1 - 2 hours,"57.64470,-4.06410",https://www.walkhighlands.co.uk/lochness/Eathie.shtml,2,Coastal,"Loch Ness, Glen Affric & the Black Isle"
"Contin Forest & View Rock circuit, near Contin",1,4.5km,1 - 1.5 hours,"57.57670,-4.59030",https://www.walkhighlands.co.uk/lochness/Continforest.shtml,1.5,Forest,"Loch Ness, Glen Affric & the Black Isle"
"Ord Hill, near North Kessock",1,4.5km,1 hour,"57.50320,-4.24760",https://www.walkhighlands.co.uk/lochness/ord-hill.shtml,1,Forest,"Loch Ness, Glen Affric & the Black Isle"
"Ormond Castle, Avoch",1,4.75km,1 - 1.5 hours,"57.55950,-4.17670",https://www.walkhighlands.co.uk/lochness/Ormondcastle.shtml,1.5,Heritage,"Loch Ness, Glen Affric & the Black Isle"
Tulloch Castle from Dingwall,1,5.5km,1.5 - 2 hours,"57.59550,-4.42880",https://www.walkhighlands.co.uk/lochness/tulloch-castle.shtml,2,Heritage,"Loch Ness, Glen Affric & the Black Isle"
"Rogie and Contin forests circuit, near Contin",1,5.75km,1.5 - 2 hours,"57.59020,-4.60740",https://www.walkhighlands.co.uk/lochness/Rogiecontin.shtml,2,Forest,"Loch Ness, Glen Affric & the Black Isle"
"Macdonald Monument and the Firth, Dingwall",1,6km,2 hours,"57.59550,-4.42880",https://www.walkhighlands.co.uk/lochness/macdonald-monument.shtml,2,Heritage,"Loch Ness, Glen Affric & the Black Isle"
Cromarty explorer,1,6.5km,1.5 - 2 hours,"57.68160,-4.03220",https://www.walkhighlands.co.uk/lochness/cromarty.shtml,2,Coastal,"Loch Ness, Glen Affric & the Black Isle"
Loch Kinellan and Strathpeffer circuit,2,6km,2 - 2.5 hours,"57.58800,-4.53840",https://www.walkhighlands.co.uk/lochness/loch-kinellan.shtml,2.5,Wetland,"Loch Ness, Glen Affric & the Black Isle"
"Knockfarrel and Cnoc Mňr, Strathpeffer",2,7km,2 hours,"57.58010,-4.54550",https://www.walkhighlands.co.uk/lochness/Knockfarrel.shtml,2,Heritage,"Loch Ness, Glen Affric & the Black Isle"
Cromarty coastal circuit and McFarquhar's Bed,2,7.6km,2 - 3 hours,"57.68160,-4.03220",https://www.walkhighlands.co.uk/lochness/Sutors.shtml,3,Coastal,"Loch Ness, Glen Affric & the Black Isle"
"Chanonry Point and Swallows Den, Fortrose",2,8km,3 - 4 hours,"57.58170,-4.13040",https://www.walkhighlands.co.uk/lochness/Chanonry.shtml,4,Coastal,"Loch Ness, Glen Affric & the Black Isle"
North Kessock and Kilmuir circuit,2,9km,3.5 - 4.5 hours,"57.50210,-4.24630",https://www.walkhighlands.co.uk/lochness/north-kessock.shtml,4.5,Coastal,"Loch Ness, Glen Affric & the Black Isle"
Rosemarkie beach and Hillockhead circuit,2,9.25km,2.5 - 3.5 hours,"57.59180,-4.11460",https://www.walkhighlands.co.uk/lochness/rosemarkie.shtml,3.5,Coastal,"Loch Ness, Glen Affric & the Black Isle"
"Knockfarrel and the Peffery Way, Dingwall",2,11km,2.5 - 3.5 hours,"57.59460,-4.42890",https://www.walkhighlands.co.uk/lochness/knockfarrel-dingwall.shtml,3.5,Heritage,"Loch Ness, Glen Affric & the Black Isle"
"Dunglass Island and the Conon, Maryburgh",2,12km,3 - 3.5 hours,"57.57790,-4.43940",https://www.walkhighlands.co.uk/lochness/dunglass-island.shtml,3.5,River,"Loch Ness, Glen Affric & the Black Isle"
"Little Wyvis, near Garve",3,10km,3 - 4 hours,"57.63680,-4.67820",https://www.walkhighlands.co.uk/lochness/little-wyvis.shtml,4,Mountain,"Loch Ness, Glen Affric & the Black Isle"
"Ben Wyvis, near Garve",3,14km,4.5 - 5.5 hours,"57.66580,-4.66680",https://www.walkhighlands.co.uk/lochness/Benwyvis.shtml,5.5,Mountain,"Loch Ness, Glen Affric & the Black Isle"
Rosemarkie to Cromarty,3,15km,5 - 5.5 hours,"57.59280,-4.11760",https://www.walkhighlands.co.uk/lochness/Cromartycoast.shtml,5.5,Coastal,"Loch Ness, Glen Affric & the Black Isle"
"Craig Phadrig, Inverness",1,2km,1 hour,"57.47440,-4.26790",https://www.walkhighlands.co.uk/lochness/craig-phadrig.shtml,1,Forest,"Loch Ness, Glen Affric & the Black Isle"
"River Ness and Caledonian Canal circuit, Inverness",1,11.5km,3.5 - 4.5 hours,"57.47730,-4.22700",https://www.walkhighlands.co.uk/lochness/Riverness.shtml,4.5,River,"Loch Ness, Glen Affric & the Black Isle"
"Dochgarroch Lock & Caledonian Canal, Inverness",1,12km,3 - 4 hours,"57.46130,-4.23950",https://www.walkhighlands.co.uk/lochness/caledonian-canal.shtml,4,Canal,"Loch Ness, Glen Affric & the Black Isle"
Culloden Battlefield Trail and Clava Cairns,1,13.25km,2.5 - 3.5 hours,"57.48270,-4.13970",https://www.walkhighlands.co.uk/lochness/culloden-clava.shtml,3.5,Heritage,"Loch Ness, Glen Affric & the Black Isle"
Brodie Castle and Pond,1,3.25km,1 hour,"57.59800,-3.70571",https://www.walkhighlands.co.uk/moray/brodie-castle.shtml,1,Heritage,Moray and Nairn walks
"Cawdor Burn circular, Cawdor",1,3.5km,up to 1 hour,"57.52600,-3.92820",https://www.walkhighlands.co.uk/moray/cawdor-burn.shtml,1,River,Moray and Nairn walks
"Sluie Walk, near Forres",1,3.5km,1 hour,"57.55210,-3.65090",https://www.walkhighlands.co.uk/moray/sluie-walk.shtml,1,River,Moray and Nairn walks
Randolph's Leap from Logie Steading,1,4km,1 hour,"57.53380,-3.66090",https://www.walkhighlands.co.uk/moray/randolphs-leap.shtml,1,River,Moray and Nairn walks
"Findhorn circular, Findhorn",1,4.5km,1 - 1.5 hours,"57.66300,-3.61620",https://www.walkhighlands.co.uk/moray/findhorn.shtml,1.5,Coastal,Moray and Nairn walks
"River Nairn circuit, Nairn",1,5km,1 - 1.5 hours,"57.59030,-3.86000",https://www.walkhighlands.co.uk/moray/river-nairn.shtml,1.5,River,Moray and Nairn walks
Culbin Forest: Hill 99 Trail,1,6km,1.5 - 2 hours,"57.63110,-3.68050",https://www.walkhighlands.co.uk/moray/culbin-forest.shtml,2,Forest,Moray and Nairn walks
"Sanquhar Loch and Nelson Tower, Forres",1,6.5km,2 hours,"57.61270,-3.60410",https://www.walkhighlands.co.uk/moray/nelson-tower.shtml,2,Heritage,Moray and Nairn walks
"Nairn to Cawdor by the river, Nairn",1,9km,2 hours one way,"57.58500,-3.86840",https://www.walkhighlands.co.uk/moray/nairn-cawdor.shtml,2,River,Moray and Nairn walks
"Culbin Forest and the Gut, near Forres",1,9.2km,2 - 3 hours,"57.63110,-3.68050",https://www.walkhighlands.co.uk/moray/the-gut.shtml,3,Wetland,Moray and Nairn walks
"Dallas Dhu and the River Findhorn circuit, Forres",1,14km,3.5 - 4.5 hours,"57.61270,-3.60410",https://www.walkhighlands.co.uk/moray/dallas-dhu.shtml,4.5,Heritage,Moray and Nairn walks
"Whiteness Point and the 'Secret Beach', Nairn",1,14.8km,3.5 - 4 hours,"57.58890,-3.86940",https://www.walkhighlands.co.uk/moray/whiteness-point.shtml,4,Coastal,Moray and Nairn walks
"Dunearn Burn & the Findhorn, Darnaway Forest",2,3.8km,1 - 1.5 hours,"57.54100,-3.67860",https://www.walkhighlands.co.uk/moray/darnaway-forest.shtml,1.5,Forest,Moray and Nairn walks
"Divie Gorge circuit, from Logie Steading",2,7.25km,2 - 3 hours,"57.53380,-3.66090",https://www.walkhighlands.co.uk/moray/divie-gorge.shtml,3,River,Moray and Nairn walks
"Nairn East Beach, Kingsteps and Culbin",2,10km,2 - 3 hours,"57.59030,-3.86000",https://www.walkhighlands.co.uk/moray/nairn-dunes.shtml,3,Coastal,Moray and Nairn walks
"Loch na Bo, near Lhanbryde",1,2.5km,1 hour,"57.62070,-3.20360",https://www.walkhighlands.co.uk/moray/loch-na-bo.shtml,1,Forest,Moray and Nairn walks
"Millbuies Country Park, near Elgin",1,2.7km,45 minutes,"57.59340,-3.27480",https://www.walkhighlands.co.uk/moray/millbuies.shtml,0.75,Forest,Moray and Nairn walks
Roseisle Forest and Dunes,1,3.5km,1.5 hours,"57.67200,-3.50380",https://www.walkhighlands.co.uk/moray/roseisle.shtml,1.5,Coastal,Moray and Nairn walks
"Oak Wood and Quarrelwood, Elgin",1,3.5km,1 - 1.5 hours,"57.65370,-3.34620",https://www.walkhighlands.co.uk/moray/quarrelwood.shtml,1.5,Forest,Moray and Nairn walks
Elgin Explorer,1,4.5km,1 - 2 hours,"57.64860,-3.31590",https://www.walkhighlands.co.uk/moray/elgin-riverside.shtml,2,River,Moray and Nairn walks
"Torrieston Forest, by Pluscarden Abbey",1,4.75km,1.5 hours,"57.61160,-3.40000",https://www.walkhighlands.co.uk/moray/torrieston.shtml,1.5,Forest,Moray and Nairn walks
Burghead Bay,1,5.5km,1.5 hours,"57.69890,-3.48820",https://www.walkhighlands.co.uk/moray/burghead-bay.shtml,1.5,Coastal,Moray and Nairn walks
"Winding Walks, near Fochabers",1,5.75km,1.5 - 2.5 hours,"57.61210,-3.07550",https://www.walkhighlands.co.uk/moray/winding-walks.shtml,2.5,Forest,Moray and Nairn walks
"Spey Bay circuit, Spey Bay",1,6.5km,1.5 - 2 hours,"57.67380,-3.09380",https://www.walkhighlands.co.uk/moray/spey-bay.shtml,2,Coastal,Moray and Nairn walks
Buckie and Portgordon: Gollachy circuit,1,8.75km,2 - 3 hours,"57.67640,-2.96440",https://www.walkhighlands.co.uk/moray/buckie.shtml,3,Coastal,Moray and Nairn walks
Bin of Cullen,2,5.5km,1.5 hours,"57.65650,-2.85310",https://www.walkhighlands.co.uk/moray/bin-of-cullen.shtml,1.5,Mountain,Moray and Nairn walks
Lossiemouth East Beach and the River Lossie,2,6.25km,1.5 - 2 hours,"57.71690,-3.28320",https://www.walkhighlands.co.uk/moray/lossiemouth.shtml,2,Coastal,Moray and Nairn walks
Cullen Bay and Portknockie circuit,2,7.5km,2 - 2.5 hours,"57.69150,-2.81910",https://www.walkhighlands.co.uk/moray/cullen-bay.shtml,2.5,Coastal,Moray and Nairn walks
Burghead and Clarkly Hill,2,7.5km,1.5 - 2 hours,"57.69890,-3.48820",https://www.walkhighlands.co.uk/moray/clarkly-hill.shtml,2,Heritage,Moray and Nairn walks
"Binn Hill from Kingston, near Garmouth",2,8.25km,2 hours,"57.67590,-3.11677",https://www.walkhighlands.co.uk/moray/binn-hill.shtml,2,Forest,Moray and Nairn walks
Hopeman to Lossiemouth,2,9km,2.5 - 3 hours,"57.71000,-3.43330",https://www.walkhighlands.co.uk/moray/hopeman-lossiemouth.shtml,3,Coastal,Moray and Nairn walks
Findlater Castle from Cullen,2,9.5km,3 - 3.5 hours,"57.69150,-2.81910",https://www.walkhighlands.co.uk/moray/findlater-castle.shtml,3.5,Heritage,Moray and Nairn walks
"Auchindoun Castle, near Dufftown",1,1.3km,30 minutes,"57.42500,-3.09300",https://www.walkhighlands.co.uk/moray/auchindoun-castle.shtml,0.5,Heritage,Moray and Nairn walks
"Linn of Ruthrie, Aberlour",1,3km,1 hour,"57.47020,-3.22980",https://www.walkhighlands.co.uk/moray/aberlour.shtml,1,River,Moray and Nairn walks
"The Dounie, Rothes",1,5.1km,1 - 2 hours,"57.52740,-3.20670",https://www.walkhighlands.co.uk/moray/dounie-rothes.shtml,2,Forest,Moray and Nairn walks
Drummuir Castle Estate and Lochpark,1,7.75km,2 - 2.5 hours,"57.48300,-3.04260",https://www.walkhighlands.co.uk/moray/drummuir.shtml,2.5,Forest,Moray and Nairn walks
"Cairn Cattoch, Archiestown",1,9.5km,2.5 - 3.5 hours,"57.48100,-3.28650",https://www.walkhighlands.co.uk/moray/archiestown.shtml,3.5,Forest,Moray and Nairn walks
The Isla Way: Dufftown to Keith,1,20.5km,4 - 5 hours,"57.44480,-3.12840",https://www.walkhighlands.co.uk/moray/isla-way.shtml,5,River,Moray and Nairn walks
"Giant's Chair walk, Dufftown",2,4.75km,1 - 1.5 hours,"57.44490,-3.12850",https://www.walkhighlands.co.uk/moray/giants-chair.shtml,1.5,River,Moray and Nairn walks
"Meikle Balloch, near Keith",2,5.2km,2 - 2.5 hours,"57.53130,-2.90560",https://www.walkhighlands.co.uk/moray/meikle-balloch.shtml,2.5,Forest,Moray and Nairn walks
"Tarnash Falls and Dunnyduff Wood, Keith",2,5.5km,1 - 1.5 hours,"57.53870,-2.95090",https://www.walkhighlands.co.uk/moray/keith.shtml,1.5,River,Moray and Nairn walks
Ben Aigan,2,8.6km,2 - 3 hours,"57.52630,-3.11510",https://www.walkhighlands.co.uk/moray/ben-aigan.shtml,3,Forest,Moray and Nairn walks
"Dufftown, Craigellachie and Aberlour circuit",2,20km,5 - 6 hours,"57.44490,-3.12850",https://www.walkhighlands.co.uk/moray/dufftown-aberlour.shtml,6,River,Moray and Nairn walks
Ben Rinnes ascent,3,7.5km,3 - 4 hours,"57.40820,-3.19207",https://www.walkhighlands.co.uk/moray/ben-rinnes.shtml,4,Mountain,Moray and Nairn walks
"Little Conval and Meikle Conval, Dufftown",3,12.5km,3.5 - 4.5 hours,"57.44490,-3.12870",https://www.walkhighlands.co.uk/moray/convals.shtml,4.5,Mountain,Moray and Nairn walks
"Corryhabbie Hill, Glen Rinnes",3,12.75km,4 - 5 hours,"57.37750,-3.21640",https://www.walkhighlands.co.uk/moray/corryhabbie-hill.shtml,5,Mountain,Moray and Nairn walks
The Tors of Ben Rinnes,4,11.5km,5 - 6 hours,"57.44150,-3.23600",https://www.walkhighlands.co.uk/moray/tors-ben-rinnes.shtml,6,Mountain,Moray and Nairn walks
Knockan Crag trail,1,2km,1 hour,"58.03350,-5.07090",https://www.walkhighlands.co.uk/ullapool/knockancrag.shtml,1,Heritage,Ullapool and Assynt walks
Clashnessie Bay and Falls,1,2.25km,45 minutes,"58.22360,-5.30918",https://www.walkhighlands.co.uk/ullapool/clashnessie-beach.shtml,0.75,Coastal,Ullapool and Assynt walks
"Leitir Easaidh all-abilities path, Little Assynt",1,2.5km,45 minutes,"58.18630,-5.11000",https://www.walkhighlands.co.uk/ullapool/leitir-easaidh.shtml,0.75,Wetland,Ullapool and Assynt walks
"Culag Woods, Lochinver",1,3km,1 hour,"58.14770,-5.24310",https://www.walkhighlands.co.uk/ullapool/culag-woods.shtml,1,Forest,Ullapool and Assynt walks
Clachtoll Beach and the Broch,1,3km,1 - 1.5 hours,"58.19090,-5.33700",https://www.walkhighlands.co.uk/ullapool/clachtoll-beach.shtml,1.5,Coastal,Ullapool and Assynt walks
"Uamh an Tartair, Knockan, Elphin",1,3.75km,1 - 1.5 hours,"58.04820,-5.03130",https://www.walkhighlands.co.uk/ullapool/uamh-an-tartair.shtml,1.5,River,Ullapool and Assynt walks
Achmelvich Beach and Alltan'abradhan,1,6km,2 hours,"58.16950,-5.30180",https://www.walkhighlands.co.uk/ullapool/achmelvich-beach.shtml,2,Coastal,Ullapool and Assynt walks
Culnacraig circular,1,7.75km,1.5 - 2 hours,"58.00000,-5.31000",https://www.walkhighlands.co.uk/ullapool/culnacraig.shtml,2,Coastal,Ullapool and Assynt walks
Acheninver Hostel and Badenscallie,2,3.25km,1 hour,"58.00000,-5.31000",https://www.walkhighlands.co.uk/ullapool/achininver.shtml,1,Coastal,Ullapool and Assynt walks
Polglass broch and Rubha Dunan,2,4km,1 hour,"58.01470,-5.33860",https://www.walkhighlands.co.uk/ullapool/polglass-broch.shtml,1,Heritage,Ullapool and Assynt walks
"Loch an t-Sabhail circuit, Little Assynt",2,4.5km,1.5 - 2 hours,"58.17680,-5.14120",https://www.walkhighlands.co.uk/ullapool/little-assynt.shtml,2,Wetland,Ullapool and Assynt walks
"Bone Caves circuit, near Inchnadamph",2,4.5km,1.5 - 2 hours,"58.11570,-4.96660",https://www.walkhighlands.co.uk/ullapool/bonecaves.shtml,2,Heritage,Ullapool and Assynt walks
"Falls of Kirkaig, Inverkirkaig",2,7km,2.5 - 3 hours,"58.12150,-5.25200",https://www.walkhighlands.co.uk/ullapool/falls-of-kirkaig.shtml,3,River,Ullapool and Assynt walks
"Traligill Caves, Inchnadamph",2,7km,2 - 2.5 hours,"58.14870,-4.97340",https://www.walkhighlands.co.uk/ullapool/traligill-caves.shtml,2.5,Heritage,Ullapool and Assynt walks
River Inver and Glencanisp circuit,2,7.5km,2.5 - 3 hours,"58.15130,-5.24090",https://www.walkhighlands.co.uk/ullapool/glencanisp.shtml,3,Wetland,Ullapool and Assynt walks
Stac Pollaidh ridge and circuit,3,4.5km,2 - 4 hours,"58.03480,-5.20740",https://www.walkhighlands.co.uk/ullapool/stacpollaidh.shtml,4,Mountain,Ullapool and Assynt walks
The Old Man of Stoer and the point,3,7km,2.5 - 3.5 hours,"58.23820,-5.40100",https://www.walkhighlands.co.uk/ullapool/old-man-of-stoer.shtml,3.5,Coastal,Ullapool and Assynt walks
Sgůrr an Fhědhleir - the Fiddler,3,8km,3.5 - 4.5 hours,"57.98440,-5.28050",https://www.walkhighlands.co.uk/ullapool/sgurr-an-fhidhleir.shtml,4.5,Mountain,Ullapool and Assynt walks
Achnahaird Bay and Garvie Bay circular,3,8.5km,2.5 - 4 hours,"58.05660,-5.35620",https://www.walkhighlands.co.uk/ullapool/achnahaird-bay.shtml,4,Coastal,Ullapool and Assynt walks
Eas a' Chual Aluinn - Britain's highest waterfall,3,9.75km,4.5 - 5.5 hours,"58.21650,-4.99800",https://www.walkhighlands.co.uk/ullapool/eas-a-chual-aluinn.shtml,5.5,River,Ullapool and Assynt walks
"Rubha Coigich circuit, Reiff",3,18km,5 - 7 hours,"58.07240,-5.45320",https://www.walkhighlands.co.uk/ullapool/rubha-coigich.shtml,7,Coastal,Ullapool and Assynt walks
Across Assynt: Elphin to Lochinver,3,19km,5 - 7 hours,"58.06340,-4.99560",https://www.walkhighlands.co.uk/ullapool/across-assynt.shtml,7,Mountain,Ullapool and Assynt walks
Cůl Beag,4,10.5km,4 - 5 hours,"58.02270,-5.07570",https://www.walkhighlands.co.uk/ullapool/cul-beag.shtml,5,Mountain,Ullapool and Assynt walks
Ben Mór Coigach and Sgůrr an Fhědhleir,4,10.5km,5 - 7 hours,"57.98440,-5.28050",https://www.walkhighlands.co.uk/ullapool/ben-more-coigach.shtml,7,Mountain,Ullapool and Assynt walks
Canisp,4,12km,5 - 6 hours,"58.09960,-4.97080",https://www.walkhighlands.co.uk/ullapool/canisp.shtml,6,Mountain,Ullapool and Assynt walks
Cůl Mňr,4,13.5km,4 - 5.5 hours,"58.03670,-5.06930",https://www.walkhighlands.co.uk/ullapool/culmor.shtml,5.5,Mountain,Ullapool and Assynt walks
